cnt,pdate,title,description,org_link,link
731,2024-02-13 10:02:00,영화감독이 꼽은 영화감상 최고의 TV는 ‘LG 올레드 TV’,빅터뉴스 김진수 기자 LG전자 올레드 TV가 영화감독과 컬러리스트 등 영상 <b>전문가</b> 및 글로벌 매체로부터... <b>인공지능</b> 음향 기술은 2채널 음원을 이제 가상의 11.1.2채널까지 변환해 풍성한 음향을 구현한다. LG전자... ,http://www.bigtanews.co.kr/article/view/big202402130002,http://www.bigtanews.co.kr/article/view/big202402130002
732,2024-02-13 10:02:00,"LG 올레드 TV, 영화 감상을 위한 '최고의 선택'",LG전자 올레드(OLED·유기발광다이오드) TV가 영화감독과 컬러리스트 등 영상 <b>전문가</b> 및 글로벌 매체로부터... <b>인공지능</b> 음향 기술은 2채널 음원을 이제 가상의 11.1.2채널까지 변환해 풍성한 음향을 구현한다. 오혜원... ,http://www.dizzotv.com/site/data/html_dir/2024/02/13/2024021380022.html,http://www.dizzotv.com/site/data/html_dir/2024/02/13/2024021380022.html
733,2024-02-13 10:02:00,"다쏘시스템, 3D익스피리언스 월드 2024 개최","<b>인공지능</b>과 디지털 트랜스포메이션부터 협업 혁신, 버추얼 트윈에 이르기까지 설계 및 제조에 관한 최신... 기업가 로니 존슨, 파이오니어 서비스의 CEO 겸 소유주이자 생산 가공 환경 <b>전문가</b>인 아니사 무사나, 무화석... ",https://www.datanet.co.kr/news/articleView.html?idxno=190959,https://www.datanet.co.kr/news/articleView.html?idxno=190959
734,2024-02-13 10:02:00,영화 볼땐 ‘LG 올레드 TV’로…글로벌 <b>전문가</b> 호평일색,LG전자는 LG 올레드 TV가 영화감독과 컬러리스트 등 영상 <b>전문가</b> 및 글로벌 매체로부터 영화 감상을 위한... 새로운 <b>인공지능</b>(AI) 업스케일링은 영상을 픽셀 단위로 분석하고 흐릿한 사물과 배경까지도 AI가 스스로... ,https://www.ekn.kr/web/view.php?key=20240213025456662,https://www.ekn.kr/web/view.php?key=20240213025456662
735,2024-02-13 10:02:00,LG전자 “‘올레드 TV’ 글로벌 호평”…고객 맞춤 경험 마케팅 지속,LG전자는 올레드 TV가 영화감독과 컬러리스트 등 영상 <b>전문가</b>와 글로벌 매체로부터 영화 감상을 위한... <b>인공지능</b> 음향 기술은 2채널 음원을 이제 가상의 11.1.2채널까지 변환해 풍성한 음향을 구현한다.오혜원... ,http://www.sentv.co.kr/news/view/679302,http://www.sentv.co.kr/news/view/679302
736,2024-02-13 10:02:00,"LG전자 올레드 TV, 영화감독·글로벌 매체 연이어 호평",(사진=LG전자) LG전자는 올레드 TV가 영화감독과 컬러리스트 등 영상 <b>전문가</b> 및 글로벌 매체로부터 영화... <b>인공지능</b> 음향 기술은 2채널 음원을 이제 가상의 11.1.2채널까지 변환해 풍성한 음향을 구현한다. LG전자... ,https://www.cnbnews.com/news/article.html?no=642975,https://www.cnbnews.com/news/article.html?no=642975
737,2024-02-13 10:02:00,LG전자 &quot;영화인들이 의심할 여지 없는 최고의 선택은 LG 올레드 TV&quot;,LG전자 올레드 TV가 영화감독과 컬러리스트 등 영상 <b>전문가</b> 및 글로벌 매체로부터 영화 감상을 위한 최고... <b>인공지능</b> 음향 기술은 2채널 음원을 이제 가상의 11.1.2채널까지 변환해 풍성한 음향을 구현한다. LG전자... ,https://www.financialpost.co.kr/news/articleView.html?idxno=200706,https://www.financialpost.co.kr/news/articleView.html?idxno=200706
738,2024-02-13 10:02:00,영상 <b>전문가</b>·글로벌 매체 'LG 올레드 TV' 잇단 호평 &quot;최고의 선택&quot;,"사진=LG전자  영화감독, 컬러리스트 등 영상 <b>전문가</b>가 영화 감상을 위한 최고 TV로 LG전자의... <b>인공지능</b> 음향 기술은 2채널 음원을 이제 가상의 11.1.2채널까지 변환해 풍성한 음향을 구현한다. 오혜원 LG전자... ",https://www.pinpointnews.co.kr/news/articleView.html?idxno=245140,https://www.pinpointnews.co.kr/news/articleView.html?idxno=245140
739,2024-02-13 10:02:00,"&quot;영화 감상 위한 최고의 선택&quot;...영상 <b>전문가</b>‧글로벌 매체, 'LG 올레드 TV' ...","영상 <b>전문가</b> 및 글로벌 매체로부터 영화 감상을 위한 최고 TV로 평가되고 있다. 13일 LG전자에 따르면... AI(<b>인공지능</b>) 성능을 기반으로 그래픽 성능과 프로세싱 속도가 각각 70%, 30% 향상됐다. 새로운 AI 업스케일링... ",http://www.4th.kr/news/articleView.html?idxno=2057257,http://www.4th.kr/news/articleView.html?idxno=2057257
740,2024-02-13 10:02:00,영화 감상을 위한 최고의 선택은 'LG 올레드 TV'...영화감독들이 인정,LG전자(대표이사 조주완) 올레드 TV가 영화감독과 컬러리스트 등 영상 <b>전문가</b> 및 글로벌 매체로부터 영화... <b>인공지능</b> 음향 기술은 2채널 음원을 이제 가상의 11.1.2채널까지 변환해 풍성한 음향을 구현한다. LG전자... ,https://www.pointdaily.co.kr/news/articleView.html?idxno=190277,https://www.pointdaily.co.kr/news/articleView.html?idxno=190277
741,2024-02-13 10:02:00,"LG전자 '올레드 TV', 영화감독 등 영상 <b>전문가</b>로부터 호평 잇따라",LG전자는 올레드 TV가 영화감독과 컬러리스트 등 영상 <b>전문가</b> 및 글로벌 매체로부터 영화 감상을 위한... <b>인공지능</b> 음향 기술은 2채널 음원을 이제 가상의 11.1.2채널까지 변환해 풍성한 음향을 구현한다. 오혜원... ,http://www.worktoday.co.kr/news/articleView.html?idxno=48654,http://www.worktoday.co.kr/news/articleView.html?idxno=48654
742,2024-02-13 10:02:00,"영화 감상을 위한 최고의 선택은 'LG 올레드 TV' ...영화감독, 글로벌매체 호...","영화감독, 컬러리스트 등 영상 <b>전문가</b>와 글로벌 매체로부터 영화 감상을 위한 최고의 TV로 인정 받은 LG... <b>인공지능</b> 음향 기술은 2채널 음원을 이제 가상의 11.1.2채널까지 변환해 풍성한 음향을 구현한다. LG전자... ",http://www.issuenbiz.com/news/articleView.html?idxno=37748,http://www.issuenbiz.com/news/articleView.html?idxno=37748
743,2024-02-13 10:01:00,"영화 감독·영상 <b>전문가</b> &quot;LG 올레드, 영화감상을 위한 최고의 TV&quot;",LG전자 올레드 TV가 영화감독과 컬러리스트 등 영상 <b>전문가</b> 및 글로벌 매체로부터 영화 감상을 위한 최고... <b>인공지능</b> 음향 기술은 2채널 음원을 이제 가상의 11.1.2채널까지 변환해 풍성한 음향을 구현한다.,https://zdnet.co.kr/view/?no=20240213091637,https://n.news.naver.com/mnews/article/092/0002321083?sid=105
744,2024-02-13 10:01:00,"문체부-한국문화예술교육진흥원, 아부다비 ‘유네스코 제3차 세계문화예술교육...","한국은 2022년 국제 <b>전문가</b> 회의, 2023년 파리 다자회담 한국 주도 행사 개최 등에 참여했다. ◇부의장 및... 및 <b>인공지능</b>과 문화예술교육 △문화예술교육 파트너십 구축 △연구·모니터링 등 논의된다. ◇한국 주도... ",https://www.sportsseoul.com/news/read/1398498?ref=naver,https://n.news.naver.com/mnews/article/468/0001029865?sid=103
745,2024-02-13 10:01:00,"LG전자 '올레드 TV', 글로벌 매체서 연이어 호평…&quot;영화 감상 위한 최고의 선...","오혜원 LG전자 HE브랜드커뮤니케이션담당은 &quot;LG 올레드 TV는 전용 <b>인공지능</b>(AI) 화질·음질 칩을 기반으로 영화감독, 컬러리스트 등 <b>전문가</b>들에게 인정받고 있다&quot;며 &quot;전 세계 영화 애호가들에게 차원이 다른 시청경험을... ",http://www.inews24.com/view/1686193,https://n.news.naver.com/mnews/article/031/0000812093?sid=101
746,2024-02-13 10:01:00,"LG 올레드 TV, 영상 <b>전문가</b>·해외 매체로부터 호평",LG전자가 LG 유기발광다이오드(OLED) TV가 영화감독과 컬러리스트 등 영상 <b>전문가</b>와 해외 매체로부터... 제품에 탑재된 알파11 프로세서는 4배 개선된 <b>인공지능</b>(AI) 성능을 기반으로 그래픽 성능과 프로세싱 속도가... ,https://biz.chosun.com/it-science/ict/2024/02/13/6ASBGLUZPZGD7NG4BE5A3YGWZE/?utm_source=naver&utm_medium=original&utm_campaign=biz,https://n.news.naver.com/mnews/article/366/0000969940?sid=105
747,2024-02-13 10:01:00,“영화 감상 위한 최고의 선택 ‘LG 올레드 TV’”,고객 맞춤 경험 마케팅 지속 영화감독 등 영상 <b>전문가</b> LG 올레드 TV에 연이어 호평 LG전자는 올레드 TV가... <b>인공지능</b> 음향 기술은 2채널 음원을 이제 가상의 11.1.2채널까지 변환해 풍성한 음향을 구현한다. 오혜원... ,https://www.ebn.co.kr/news/view/1612520/?sc=Naver,https://www.ebn.co.kr/news/view/1612520/?sc=Naver
748,2024-02-13 10:01:00,"LG 올레드 TV, 글로벌 영화감독들도 인정…“의심할 여지 없는 최고의 선택”...","영상 <b>전문가</b>와 글로벌 매체로부터 영화 감상을 위한 최고의 TV로 인정 받았다. 사진 | LG전자 LG전자 올레드... 제품에는 4배 강력해진 <b>인공지능</b>(AI) 기반 그래픽 성능과 프로세싱 속도가 각각 70%, 30% 향상된 알파11... ",https://www.sportsseoul.com/news/read/1398490?ref=naver,https://n.news.naver.com/mnews/article/468/0001029864?sid=101
749,2024-02-13 10:00:00,"KT, 글로벌 AI 컨퍼런스 Remarkable 2024 참가","KT가 글로벌 <b>인공지능</b>(AI) 연구 기관 캐나다 벡터 연구소가 주최한 AI 컨퍼런스 'Remarkable 2024'에 참가했다고 13일 밝혔다. Remarkable 2024는 석학, 산업 종사자, 스타트업, 정부 관계자 등 AI <b>전문가</b>들이 각 분야의 AI... ",https://www.newscj.com/news/articleView.html?idxno=3108312,https://www.newscj.com/news/articleView.html?idxno=3108312
750,2024-02-13 10:00:00,"바이오헬스케어 업계, 입체적 사업 다각화로 新성장 기회 모색",이번 협약은 '비전프로 딥러닝 및 LMM을 활용한 <b>인공지능</b> 기반의 영상분석 시스템'에 대한 협력사업 확장을... 벳플은 동아제약의 수의사들과 <b>전문가</b>가 직접 개발에 참여한 반려동물 맞춤 영양제로 강아지와 고양이를... ,http://www.bokuennews.com/news/article.html?no=240208,http://www.bokuennews.com/news/article.html?no=240208
751,2024-02-13 10:00:00,'성난사람들' 이성진 &quot;다음 작품 작업에 LG 올레드 TV 쓰고 싶어&quot;,LG전자는 자사의 올레드 TV가 영화감독과 컬러리스트 등 영상 <b>전문가</b> 및 글로벌 매체로부터 영화 감상을... <b>인공지능</b> 음향 기술은 2채널 음원을 이제 가상의 11.1.2채널까지 변환해 풍성한 음향을 구현한다. 오혜원... ,https://www.dailian.co.kr/news/view/1327547/?sc=Naver,https://n.news.naver.com/mnews/article/119/0002798960?sid=101
752,2024-02-13 10:00:00,"LG 올레드TV, 영화감독·색상<b>전문가</b> 잇단 호평…&quot;컬러손실 없어&quot;",영상 <b>전문가</b>와 글로벌 정보기술(IT) 매체로부터 영화 감상용 TV로서 우수한 성능을 인정받았다고 LG전자가... 앞서 LG전자는 지난달 미국 라스베이거스에서 열린 가전·IT 전시회 'CES 2024'에서 전보다 향상된 <b>인공지능</b>... ,https://www.yna.co.kr/view/AKR20240213024900003?input=1195m,https://n.news.naver.com/mnews/article/001/0014501644?sid=101
753,2024-02-13 10:00:00,"충북도, 2024 충북반도체산업육성 3대전략 추진",최근 반도체산업 환경은 산업의 트랜드의 급변화와 생성형<b>인공지능</b>(AI)의 확산으로 <b>인공지능</b>반도체 시장... 반도체 <b>전문가</b> 포럼 등 다양한 사업을 내용으로 한다. 충북도 김진형 과학인재국장은 &quot;글로벌 경기침체... ,https://www.gukjenews.com/news/articleView.html?idxno=2920212,https://www.gukjenews.com/news/articleView.html?idxno=2920212
754,2024-02-13 10:00:00,'성난 사람들' 감독도 인정…&quot;LG 올레드 TV가 영화보기에 최고&quot;,"LG전자는 올레드 TV가 영화감독, 컬러리스트 등 영상 <b>전문가</b>와 글로벌 매체로부터 영화 감상을 위한 최고... <b>인공지능</b>(AI) 성능 4배, 그래픽 성능 70%, 프로세싱 속도 30% 향상됐다. 오혜원 LG전자 HE(홈 엔터테인먼트)... ",https://view.asiae.co.kr/article/2024021308020858356,https://n.news.naver.com/mnews/article/277/0005378972?sid=101
755,2024-02-13 09:56:00,삼성전자 훈풍?...퀄리타스반도체 등 온디바이스AI주 '장중 급등',"13일 증시에서 HPSP, 오픈엣지테크놀로지, 퀄리타스반도체 등 온디바이스AI(<b>인공지능</b>) 관련주로 꼽히는... 특히 &quot;테마주는 상황에 따라 급변 가능성이 있는 만큼&quot; 신중한 투자 자세를 견지해야 한다는 게 <b>전문가</b>들... ",http://www.choicenews.co.kr/news/articleView.html?idxno=126786,http://www.choicenews.co.kr/news/articleView.html?idxno=126786
756,2024-02-13 09:51:00,"KT, 캐나다 글로벌 AI 컨퍼런스 '리마커블 2024' 참가","KT는 글로벌 AI(<b>인공지능</b>) 연구기관 '캐나다 벡터 연구소'가 최근 주최한 AI 컨퍼런스 'Remarkable 2024... 리마커블 2024는 석학, 산업 종사자, 스타트업, 정부 관계자 등 AI <b>전문가</b>들이 각 분야의 AI 응용 사례 및 전망과... ",https://www.starnewskorea.com/stview.php?no=2024021309482228403,https://n.news.naver.com/mnews/article/108/0003214472?sid=004
757,2024-02-13 09:46:00,"KT, 글로벌 AI 컨퍼런스 Remarkable 2024 참석",열린 <b>인공지능</b>(AI) 컨퍼런스 'Remarkable 2024'에 참가했다고 13일 밝혔다. Remarkable 2024는 글로벌 AI 연구 기관 '캐나다 벡터 연구소(Vector Institute)' 주최로 AI <b>전문가</b>들이 각 분야의 AI 응용 사례 및 전망과... ,https://www.pinpointnews.co.kr/news/articleView.html?idxno=245157,https://www.pinpointnews.co.kr/news/articleView.html?idxno=245157
758,2024-02-13 09:42:00,엔비디아 젠슨 황 “각국 독자적인 AI인프라 세워야”,"<b>인공지능</b>(AI) 최첨단 반도체 시장을 주도하고 있는 엔비디아의 젠슨 황 최고경영책임자(CEO)가 반도체 성능... 이들 외에도 메타, 샌드박스AQ, 비욘드리미츠 등 세계 주요 기업의 AI 분야 <b>전문가</b> 100명도 참석했다.",http://news.heraldcorp.com/view.php?ud=20240213050146,https://n.news.naver.com/mnews/article/016/0002265629?sid=104
759,2024-02-13 09:42:00,"콘진원, 뉴콘텐츠아카데미 프로젝트 쇼케이스 연다",<b>전문가</b> 평가 및 프로젝트를 직접 체험한 참관객 투표를 통해 분야별 우수 프로젝트를 선정한다.... ▲3D 애니메이션 호문클루스의 1987 ▲단편영화 지붕 위의 질투의 50그램 ▲<b>인공지능</b> 음악영화 삭제된 세계의... ,https://www.cnet.co.kr/view/?no=20240213090420,https://www.cnet.co.kr/view/?no=20240213090420
760,2024-02-13 09:41:00,"KT, 글로벌 AI 컨퍼런스 Remarkable 2024 참가","KT가 글로벌 <b>인공지능</b>(AI) 연구 기관 '캐나다 벡터 연구소(Vector Institute)'가 주최한 AI 컨퍼런스... [사진=KT] Remarkable 2024는 석학, 산업 종사자, 스타트업, 정부 관계자 등 AI <b>전문가</b>들이 각 분야의 AI 응용... ",https://www.newspim.com/news/view/20240213000230,https://www.newspim.com/news/view/20240213000230
761,2024-02-13 09:41:00,"KT, 글로벌 AI 연구기관 벡터연구소 주최 컨퍼런스 참가","KT가 글로벌 <b>인공지능</b>(AI) 연구 기관 캐나다 벡터 연구소가 주최한 AI 컨퍼런스 리마커블(Remarkable) 2024에 참가했다고 13일 밝혔다. 리마커블은 석학, 산업 종사자, 스타트업, 정부 관계자 등 AI <b>전문가</b>들이 각 분야 AI... ",https://zdnet.co.kr/view/?no=20240213092144,https://n.news.naver.com/mnews/article/092/0002321073?sid=105
762,2024-02-13 09:40:00,"'LG 올레드 TV', 영화 관계자들에 찬사 받아... &quot;컬러 손실 없는 표현&quot;","<b>인공지능</b> 음향 기술은 2채널 음원을 이제 가상의 11.1.2채널까지 변환해 풍성한 음향을 구현한다. LG전자 관계자는 &quot;LG 올레드 TV는 전용 AI 화질·음질 칩을 기반으로 영화감독, 컬러리스트 등 <b>전문가</b>들에게 인정 받고... ",http://www.chemicalnews.co.kr/news/articleView.html?idxno=8455,http://www.chemicalnews.co.kr/news/articleView.html?idxno=8455
763,2024-02-13 09:38:00,"콘진원, 뉴콘텐츠아카데미(NCA) 프로젝트 쇼케이스 개최",<b>전문가</b> 평가 및 프로젝트를 직접 체험한 참관객 투표를 통해 분야별 우수 프로젝트를 선정한다.... ▲3D 애니메이션 &lt;호문클루스&gt;의 1987 ▲단편영화 &lt;지붕 위의 질투&gt;의 50그램 ▲<b>인공지능</b> 음악영화 &lt;삭제된 세계&gt;의... ,https://idsn.co.kr/news/view/1065573299471824,https://idsn.co.kr/news/view/1065573299471824
764,2024-02-13 09:38:00,"KT, 글로벌 AI 컨퍼런스 참가…석학들과 AI 전망 논의","KT는 글로벌 AI(<b>인공지능</b>) 연구기관 '캐나다 벡터 연구소'가 주최한 AI 컨퍼런스 'Remarkable 2024(리마커블 2024)... 리마커블 2024는 석학, 산업 종사자, 스타트업, 정부 관계자 등 AI <b>전문가</b>들이 각 분야의 AI 응용 사례 및... ",http://www.newsis.com/view/?id=NISX20240213_0002624235&cID=13005&pID=13100,https://n.news.naver.com/mnews/article/003/0012369261?sid=105
765,2024-02-13 09:36:00,"시흥시, 여성인력 양성하는 '직업교육훈련과정' 운영",시흥여성인력개발센터(대야동)에서는 ▲단체급식조리실무자 ▲간호조무사 현장간호실무 ▲웹콘텐츠디자인 ▲세무사무원 ▲<b>인공지능</b> 교육지도<b>전문가</b> ▲디지털마케팅<b>전문가</b> ▲반려동물<b>전문가</b> 창업 ▲<b>인공지능</b>(AI)... ,https://www.gukjenews.com/news/articleView.html?idxno=2920165,https://www.gukjenews.com/news/articleView.html?idxno=2920165
766,2024-02-13 09:36:00,"경북도, 안전·물류·농업 등 3대 특화 로봇산업 R&amp;D 역량 집중 지원","구축과 <b>인공지능</b>, 소프트웨어 전문지식을 갖추기 위한 인력 고도화 사업을 추진하여 로봇직무 필수 기초이론을 넘어 로봇활용 분야별 전문 특화 인력 양성에 노력할 방침이다. 산학연 <b>전문가</b>와 함께 추진전략 점검 체계... ",http://www.mtnews.net/news/view.php?idx=17923,http://www.mtnews.net/news/view.php?idx=17923
767,2024-02-13 09:35:00,"KT, 글로벌 AI 컨퍼런스 '리마커블 2024' 참가","AI(<b>인공지능</b>) 연구 기관 '캐나다 벡터 연구소'가 주최한 AI 컨퍼런스 '리마커블(Remarkable) 2024'에 참가했다고 13일 밝혔다. Remarkable 2024는 석학, 산업 종사자, 스타트업, 정부 관계자 등 AI <b>전문가</b>들이 각 분야의 AI 응용... ",https://www.ddaily.co.kr/page/view/2024021309274608330,https://n.news.naver.com/mnews/article/138/0002166696?sid=105
768,2024-02-13 09:26:00,"문체부-한국문화예술교육진흥원, 유네스코 세계대회 참가","그간 한국은 2022년 국제 <b>전문가</b> 회의, 2023년 파리 다자회담 한국 주도 행사 개최 등 국제 담론을... 및 <b>인공지능</b>과 문화예술교육 △문화예술교육 파트너십 구축 △연구·모니터링 등이다. ■ 한국 주도... ",http://www.fnnews.com/news/202402130915322003,https://n.news.naver.com/mnews/article/014/0005141235?sid=103
769,2024-02-13 09:26:00,젊은 CEO 강석훈 에이블리 대표…연간 흑자 비결 '이것'에 있었다,15년간 ‘개인화’를 연구한 <b>전문가</b>들이 모여 자체 개발한 <b>인공지능</b>(AI) 추천 알고리즘은 취향 데이터 기반으로 고객의 취향에 맞는 상품을 정확히 연결해 준다. 초개인화 커머스 구축에 있어 가장 중요한 것은... ,https://www.smartfn.co.kr/article/view/sfn202402130003,https://www.smartfn.co.kr/article/view/sfn202402130003
770,2024-02-13 09:20:00,"다쏘시스템, 3D익스피리언스 월드 2024 개최","통해 <b>인공지능</b>과 디지털 트랜스포메이션부터 협업 혁신, 버추얼 트윈에 이르기까지 설계 및 제조에 관한... 환경 <b>전문가</b>인 아니사 무사나(Aneesa Muthana), 무화석 합성 연료 회사 제로(Zero)의 설립자 겸 경영자로 전... ",https://www.epnc.co.kr/news/articleView.html?idxno=240652,https://www.epnc.co.kr/news/articleView.html?idxno=240652
771,2024-02-13 09:16:00,"시흥시, 취업희망 여성에 직업교육훈련 시행",시흥여성인력개발센터(대야동)에서는 ▲단체급식조리실무자 ▲간호조무사 현장간호실무 ▲웹콘텐츠디자인 ▲세무사무원 ▲<b>인공지능</b> 교육지도<b>전문가</b> ▲디지털마케팅<b>전문가</b> ▲반려동물<b>전문가</b> 창업 ▲<b>인공지능</b>(AI)... ,https://www.siminilbo.co.kr/news/newsview.php?ncode=1160259133856216,https://www.siminilbo.co.kr/news/newsview.php?ncode=1160259133856216
772,2024-02-13 09:10:00,[뉴욕마켓워치] CPI 앞두고 경계 모드…채권·달러↑주식 혼조,반도체 설계 기업 Arm 홀딩스의 주가는 실적 발표 이후 <b>인공지능</b>(AI)에 대한 기대가 유지되며 30% 가까이... 뉴욕증시 <b>전문가</b>들은 주요 지수가 5천선을 돌파한 이후 조정 압력을 받을 수 있다고 말했다. 또한... ,https://news.einfomax.co.kr/news/articleView.html?idxno=4298239,https://news.einfomax.co.kr/news/articleView.html?idxno=4298239
773,2024-02-13 09:08:00,"포스코, 차기 회장 낙점...정통 철강맨 '장인화號' 순항할까","외부인사보다는 내부 철강 <b>전문가</b>를 선택한 결과로 풀이된다. 이에 따라 장 전 사장은 3월21일 예정된... 과거 포스코 사장 재임 시절에는 <b>인공지능</b>(AI) 신기술을 이용한 제철소 스마트팩토리 체계를 구축했으며, 국내기업... ",http://www.issuenbiz.com/news/articleView.html?idxno=37739,http://www.issuenbiz.com/news/articleView.html?idxno=37739
774,2024-02-13 09:02:00,광주경자구역에 AI 지식산업센터 건립,"AI융복합지구 지식산업센터는 <b>인공지능</b>(AI) 벤처기업 등 유망 중소기업에 공공임대형 입주공간을 제공하는... 특히 기업하기 좋은 입주공간을 마련하기 위해 설계 단계부터 AI기업 의견 청취, 사례조사, AI <b>전문가</b>... ",https://www.aitimes.com/news/articleView.html?idxno=157112,https://www.aitimes.com/news/articleView.html?idxno=157112
775,2024-02-13 09:02:00,"시흥시, 취업희망 여성 직업교육훈련 시행",시흥여성인력개발센터(대야동)에서는 ▲단체급식조리실무자 ▲간호조무사 현장간호실무 ▲웹콘텐츠디자인 ▲세무사무원 ▲<b>인공지능</b> 교육지도<b>전문가</b> ▲디지털마케팅<b>전문가</b> ▲반려동물<b>전문가</b> 창업 ▲<b>인공지능</b>(AI)... ,http://www.metroseoul.co.kr/article/20240213500010,http://www.metroseoul.co.kr/article/20240213500010
776,2024-02-13 08:54:00,"뉴욕증시, 1월 CPI 앞두고 혼조…국제유가, 6일째 상승",반도체 설계 기업 Arm 홀딩스의 주가는 실적 발표 이후 <b>인공지능</b>(AI)에 대한 기대가 유지되며 30% 가까이... 뉴욕증시 <b>전문가</b>들은 주요 지수가 5000선을 돌파한 이후 조정 압력을 받을 수 있다고 말했다. 또한... ,https://www.asiatime.co.kr/article/20240213500007,https://www.asiatime.co.kr/article/20240213500007
777,2024-02-13 08:51:00,&quot;이사회 장악 후 전면 경영쇄신&quot;…한미약품 장차남 선전포고,"제약·바이오 <b>전문가</b>가 없다는 위기의식도 작용한 것으로 보인다. 한미약품은 임성기 선대회장의 의지에... 대한 <b>인공지능</b>(AI)기반 맞춤형 바이오마커 개발 사업이 방치됐고, 옥스퍼드대학과의 협약이 좌초될 위기에... ",http://www.edaily.co.kr/news/newspath.asp?newsid=01610486638790192,https://n.news.naver.com/mnews/article/018/0005671888?sid=101
778,2024-02-13 08:50:00,다쏘시스템 3D익스피리언스 월드 2024 개최,"통해 <b>인공지능</b>과 디지털 트랜스포메이션부터 협업 혁신, 버추얼 트윈에 이르기까지 설계 및 제조에 관한... 환경 <b>전문가</b>인 아니사 무사나(Aneesa Muthana), 무화석 합성 연료 회사 제로(Zero)의 설립자 겸 경영자로 전... ",http://www.ikld.kr/news/articleView.html?idxno=289255,http://www.ikld.kr/news/articleView.html?idxno=289255
779,2024-02-13 08:50:00,"다쏘시스템, 설계·제조 지속 가능성 위한 '3D익스피리언스 월드' 개최","다양한 패널 발표, 기술 및 교육 세션, 네트워킹을 통해 <b>인공지능</b>과 디지털 트랜스포메이션부터 협업 혁신... 환경 <b>전문가</b>인 아니사 무사나, 무화석 합성 연료 회사 제로의 설립자 겸 경영자로 전 포뮬러 1 엔지니어 및... ",https://www.hellot.net/news/article.html?no=86719,https://www.hellot.net/news/article.html?no=86719
