cnt,pdate,title,description,org_link,link
1,2024-02-15 16:12:00,&quot;저출산·고령화...2040년 잠재성장률 0.7%까지 하락&quot; -대한상의,"Vehicles), <b>인공지능</b>(Artificial Intelligence) 등 신기술 분야에서 혁신을 주도했던 일본*이 현재는 젊은 인재들의... 고숙련 <b>전문가</b>를 활용할 수 있는 직무 분석 및 발굴 등이 필요하다&quot;고 말했다. 해외 전문인력을 국내로... ",http://www.biztribune.co.kr/news/articleView.html?idxno=304556,http://www.biztribune.co.kr/news/articleView.html?idxno=304556
2,2024-02-15 16:10:00,&quot;연금 VIP 모십니다&quot;…하나은행 '연금 더 드림 라운지' 여의도 오픈,연금관리 뿐 아니라 세무·부동산·상속·증여 등 자산관리 전 분야의 <b>전문가</b>와 연계한 하나은행만의... 또 ▲모바일 연금닥터 서비스 ▲<b>인공지능</b>(AI)연금투자솔루션 등 비대면 채널에서도 차별화된 자산관리 서비스를... ,http://www.4th.kr/news/articleView.html?idxno=2057435,http://www.4th.kr/news/articleView.html?idxno=2057435
3,2024-02-15 16:08:00,"제주도, <b>인공지능</b>(AI) 역량강화 도민 교육 본격 운영","이번 프로그램은 RIS사업 지역혁신자율과제의 일환으로 마련됐으며, 국내 <b>인공지능</b>(AI) 분야의 대표적인 스타트업인 '업스테이지(Upstage)'가 교육 진행을 맡는다. AI <b>전문가</b>인 업스테이지 김성훈 최고경영책임자(CEO)와... ",http://www.headlinejeju.co.kr/news/articleView.html?idxno=536352,http://www.headlinejeju.co.kr/news/articleView.html?idxno=536352
4,2024-02-15 16:08:00,미래에셋증권 '이번 주 챙겨볼 금융상품' 조회수↑,관계자는 &quot;현재 <b>인공지능</b> 역할이 투자자의 자산배분을 넘어 금융 상품 추천까지 확장되고 있지만 실제로 고객들은 투자결정을 할 때 <b>전문가</b>의 도움을 필요로 하고 있다&quot;며 &quot;특히 투자 경험이 적은 초보 투자자일수록... ,http://www.handmk.com/news/articleView.html?idxno=20252,http://www.handmk.com/news/articleView.html?idxno=20252
5,2024-02-15 16:06:00,"미래에셋증권, M-STOCK '이번 주 챙겨볼 금융상품' 조회수 100만 돌파",미래에셋증권 관계자는 '현재 <b>인공지능</b> 역할이 투자자의 자산배분을 넘어 금융 상품 추천까지 확장되고 있지만 실제로 고객들은 투자결정을 할 때 <b>전문가</b>의 도움을 필요로 하고 있다&quot;라며 &quot;특히 투자 경험이 적은 초보... ,http://www.womentimes.co.kr/news/articleView.html?idxno=71087,http://www.womentimes.co.kr/news/articleView.html?idxno=71087
6,2024-02-15 16:02:00,[김장현의 테크와 사람] 〈43〉그래도 인재가 미래다,"<b>인공지능</b>(AI)이 좋아 관련 전공으로 진학했고, 1학년 때에는 미적분, 선형대수, 일반물리 등을 들으며 수리적... 의사과학자가 필요하다면, AI윤리 <b>전문가</b>도 필요하며, 기술에 아트를 접목하는 테크노아티스트도 필요하다.... ",https://www.etnews.com/20240215000005,https://n.news.naver.com/mnews/article/030/0003181321?sid=110
7,2024-02-15 16:02:00,저출산·고령화로 생산인구 감소... &quot;생산성 높여야 미래 희망&quot;,"김천구 대한상의 SGI 연구위원은 &quot;과거 수소 저장, 자율주행 차량, <b>인공지능</b>(AI) 등 신기술 분야에서 혁신을... 고숙련 <b>전문가</b>를 활용할 수 있는 직무 분석 및 발굴 등이 필요하다&quot;고 제언했다. 해외 전문인력을 국내로... ",https://www.joongdo.co.kr/web/view.php?key=20240215010004094,https://www.joongdo.co.kr/web/view.php?key=20240215010004094
8,2024-02-15 16:02:00,대한상의 &quot;2040년 잠재성장률 0.7% 하락&quot; 저출산·고령화 영향,"Vehicles), <b>인공지능</b>(Artificial Intelligence) 등 신기술 분야에서 혁신을 주도했던 일본이 현재는 젊은 인재의... 고숙련 <b>전문가</b>를 활용할 수 있는 직무 분석‧발굴 등이 필요하다&quot;고 말했다. 해외 전문인력을 국내로... ",https://www.womennews.co.kr/news/articleView.html?idxno=245489,https://n.news.naver.com/mnews/article/310/0000114404?sid=101
9,2024-02-15 16:02:00,[리더스포럼] IT 최대경연장 CES,"그 주<b>인공</b>은 단연 <b>인공지능</b>(AI)으로 신기술·신제품이 대거 출품됐다. 시장조사업체 포레스터의 디판잔... 국내 대표 AI <b>전문가</b> 배경훈 LG AI연구원장 등과 CES를 소개한 관람후기, 현장취재를 통한 분석자료들은... ",https://www.etnews.com/20240214000346,https://n.news.naver.com/mnews/article/030/0003181312?sid=110
10,2024-02-15 16:02:00,이창한 “난 이공계·관료 출신 경제인…개혁신당의 차별화 포인트” [인터뷰...,경제<b>전문가</b>…현실적인 정책 마련 가능&quot; &quot;개혁신당 아직 색채 불분명…우리만의 색깔 찾아야&quot; 4·10 총선을... “<b>인공지능</b>(AI)과 반도체가 이 시대의 화두 중 하나다. 반도체 없이는 앞으로 <b>지능</b>사회에 대처할 수 없기 때문에... ,https://www.etoday.co.kr/news/view/2331327,https://www.etoday.co.kr/news/view/2331327
11,2024-02-15 16:02:00,"무하유, 국회도서관 융복합서비스 데이터셋 구축사업 완료",무하유는 이번 사업을 통해 국회도서관에서 제공 중인 <b>인공지능</b>(AI) 의정분석 서비스 '아르고스'에 법률 관련... 무하유는 원활한 사업 추진을 위해 법률 지식을 보유한 <b>전문가</b>들을 포함한 데이터셋 구축인력을 구성했다.... ,https://www.etnews.com/20240215000318,https://n.news.naver.com/mnews/article/030/0003181320?sid=105
12,2024-02-15 16:02:00,"곡성군, 행안부 데이터기반행정 평가 3년 연속 '최고등급'",민간<b>전문가</b>로 구성된 점검단은 '데이터기반행정 관리체계'와 '데이터 공동활용' '데이터 분석 및 정책활용... 군에서는 데이터기반행정 역량문화 조성을 위해 데이터 기술의 변화에 따른 <b>인공지능</b> ChatGPT 직원교육과 홍보... ,http://www.newsworker.co.kr/news/articleView.html?idxno=319341,http://www.newsworker.co.kr/news/articleView.html?idxno=319341
13,2024-02-15 16:01:00,철도 AI교통 시대 개막···&quot;경쟁력은 독점 아닌 기능분리&quot;,<b>인공지능</b>(AI)을 활용한 '제2철도교통관제센터' 사업이 본격화하면서 코레일의 철도관제권 독점 문제가 다시... 이와 관련해 철도 <b>전문가</b>들은 코레일이 처음 운영‧유지보수‧관제를 시작한 시절과 철도 산업 환경이... ,http://www.enewstoday.co.kr/news/articleView.html?idxno=2090430,http://www.enewstoday.co.kr/news/articleView.html?idxno=2090430
14,2024-02-15 16:01:00,"[K바이오 심장, 홍릉이 뛴다] 아·태 헬스케어 거점 싱가포르 손잡고 동남아로",지원 <b>전문가</b> “싱가포르도 홍릉특구와 협력 성공 사례 꼽혀” 지난 1월 22일 싱가포르 중심업무지구에 있는... 망막 혈관 사진을 촬영해 심혈관·신장 질환을 예측하는 <b>인공지능</b>(AI) 의료기기 ‘닥터눈’을 개발하는... ,https://biz.chosun.com/science-chosun/science/2024/02/15/REIJJ7LPJFDT7JF6TUOHYXPZ2E/?utm_source=naver&utm_medium=original&utm_campaign=biz,https://n.news.naver.com/mnews/article/366/0000970637?sid=105
15,2024-02-15 15:54:00,"미래에셋생명, '글로벌 MVP60' 누적 수익률 70% 돌파",글로벌 자산배분 <b>전문가</b>가 매분기 시장 상화에 맞춰 펀드 간 비중을 조정해 운용한다. 글로벌 MVP60은... 유지하며 <b>인공지능</b>(AI)을 통해 수익모델을 다양화할 미국 소프트웨어 기업들에 대한 투자비중을 크게 늘렸다.... ,http://www.shinailbo.co.kr/news/articleView.html?idxno=1829345,http://www.shinailbo.co.kr/news/articleView.html?idxno=1829345
16,2024-02-15 15:54:00,"미래에셋생명, 변액펀드 누적 수익률 70% 기록","자산배분 <b>전문가</b>가 매 분기 시장 상황에 맞춰 펀드 간 비중을 조정하며 운용하고 있다. 미래에셋생명... 유지하며, <b>인공지능</b>(AI)을 통해 수익모델을 다양화할 미국 소프트웨어 기업들에 대한 투자 비중을 크게... ",http://www.ftoday.co.kr/news/articleView.html?idxno=316302,http://www.ftoday.co.kr/news/articleView.html?idxno=316302
17,2024-02-15 15:50:00,"미래에셋증권 M-STOCK '이번 주 챙겨볼 금융상품', 조회수 100만 돌파",미래에셋증권 관계자는 &quot;현재 <b>인공지능</b> 역할이 투자자의 자산배분을 넘어 금융 상품 추천까지 확장되고 있지만 실제로 고객들은 투자결정을 할 때 <b>전문가</b>의 도움을 필요로 하고 있다&quot;며 &quot;특히 투자 경험이 적은 초보... ,http://www.kdfnews.com/news/articleView.html?idxno=126871,http://www.kdfnews.com/news/articleView.html?idxno=126871
18,2024-02-15 15:48:00,"미래에셋증권, '이번 주 챙겨볼 금융상품' 조회수 100만 돌파","미래에셋증권 관계자는 &quot;현재 <b>인공지능</b> 역할이 투자자의 자산배분을 넘어 금융 상품 추천까지 확장되고 있지만 실제로 고객들은 투자결정을 할 때 <b>전문가</b>의 도움을 필요로 하고 있다&quot;라며, &quot;특히 투자 경험이 적은 초보... ",https://www.ziksir.com/news/articleView.html?idxno=51951,https://www.ziksir.com/news/articleView.html?idxno=51951
19,2024-02-15 15:42:00,2040년 한국 잠재성장률 0.7%…&quot;혁신 성장 이끌 연구원 육성해야&quot;,"김천구 대한상의 SGI 연구위원은 “자율주행 차량, <b>인공지능</b>(AI) 등 신기술 분야에서 혁신을 주도했던... 고숙련 <b>전문가</b>를 활용할 수 있는 직무 분석 및 발굴 등도 필요하다”고 설명했다. 이와 함께 해외 전문인력... ",https://www.hankyung.com/article/202402156282i,https://n.news.naver.com/mnews/article/015/0004948788?sid=101
20,2024-02-15 15:40:00,[제약업계 소식] 2월 15일,"이화여자대학교와 '<b>인공지능</b> 알고리즘을 이용한 신약개발 협력 연구'를 위한 업무협약을 체결했다고 지난... 출신 <b>전문가</b>들이 설립한 바이오 기업이다. 생물공학적으로 약물작용점, 작용강도 및 치료 지속 시간을... ",http://www.doctorstimes.com/news/articleView.html?idxno=226049,http://www.doctorstimes.com/news/articleView.html?idxno=226049
21,2024-02-15 15:34:00,"KT, 올해 1000명 뽑는다…상반기 500여명 채용","KT는 초거대 <b>인공지능</b>(AI) 기술 개발 등 정보기술(IT), 디지털 미디어 분야 신입·경력직원 수백명을 공개... 당시 경영지원·법무·기술 최고책임자 자리는 외부 <b>전문가</b>에게 맡겼다. 김 대표가 실질적인 변화를 도모할 수... ",https://www.hankyung.com/article/202402156255i,https://n.news.naver.com/mnews/article/015/0004948778?sid=105
22,2024-02-15 15:24:00,"미래에셋생명, 저위험·고성과 '글로벌 MVP60' 누적수익률 70% 돌파","배분 <b>전문가</b>가 매 분기 시장 상황에 맞춰 펀드간 비중을 조정하면서 운용되고 있다. 펀드 변경이 어렵거나... 유지하고, <b>인공지능</b>(AI)을 통해 수익 모델을 다양화할 미국 소프트웨어 기업들에 대한 투자 비중을 크게... ",http://www.updownnews.co.kr/news/articleView.html?idxno=307231,http://www.updownnews.co.kr/news/articleView.html?idxno=307231
23,2024-02-15 15:21:00,"문체부, 국제사회 소통 위해 외신 AI 기반 플랫폼 구축 추진",지스트는 지난달 말 분야별 <b>전문가</b>들로 구성한 민간위탁운영위원회 심의를 통해 업무협약 기관으로 선정됐으며 이번 협약에 따라 2026년까지 '<b>인공지능</b> 기반 외신 빅데이터 분석 플랫폼'을 구축한다. 지스트는 고성능... ,https://www.dt.co.kr/contents.html?article_no=2024021502109931078006&ref=naver,https://n.news.naver.com/mnews/article/029/0002855454?sid=105
24,2024-02-15 15:20:00,"<b>인공지능</b>에 손대기 시작한 해킹 단체들, 시작은 미약하지만 끝은 창대할지도",<b>인공지능</b>이 공격에 활용되는 건 가설도 아니고 공상도 아니며 기술 회의론자들의 과대망상도 아니다.... 해킹 <b>전문가</b>들이다. 이들은 오픈AI의 대형 언어 모델을 사용해 기본적인 스크립팅 작업을 해결하고 있는... ,http://www.boannews.com/media/view.asp?idx=126719&kind=,http://www.boannews.com/media/view.asp?idx=126719&kind=
25,2024-02-15 15:20:00,"CJ대한통운, 美 ‘매니페스트 2024' 참가…&quot;K-물류 전파&quot;","올해 행사에는 물류 분야를 선도하는 4500여명의 업계 <b>전문가</b>들이 현장을 찾았다. 로봇 공학, 기술 플랫폼... CJ대한통운은 TES(기술·엔지니어링·시스템)기술에 기반한 빅데이터·AI(<b>인공지능</b>) 등 첨단기술을 토대로... ",https://www.theguru.co.kr/news/article.html?no=66606,https://www.theguru.co.kr/news/article.html?no=66606
26,2024-02-15 15:20:00,미래에셋생명 플래그십 펀드 누적수익률 70% 돌파,글로벌 자산배분 <b>전문가</b>가 매분기 시장 상화에 맞춰 펀드 간 비중을 조정해 운용한다. 글로벌 MVP60은... 유지하며 <b>인공지능</b>(AI)을 통해 수익모델을 다양화할 미국 소프트웨어 기업들에 대한 투자비중을 크게 늘렸다.... ,https://www.dailian.co.kr/news/view/1328720/?sc=Naver,https://n.news.naver.com/mnews/article/119/0002799919?sid=101
27,2024-02-15 15:20:00,[오전 주요 국제금융뉴스] (15일),이는 월스트리트저널(WSJ)이 집계한 <b>전문가</b> 전망치 4.0%와 지난해 12월의 실업률 3.9%를 모두 웃돈... 먼스터는 <b>인공지능</b>(AI)이 주도하는 증시 강세장 전망은 여전히 유효하다면서도 금리 인하 베팅엔 신중해야... ,https://news.einfomax.co.kr/news/articleView.html?idxno=4298644,https://news.einfomax.co.kr/news/articleView.html?idxno=4298644
28,2024-02-15 15:18:00,"미래에셋증권, '이번 주 챙겨볼 금융상품' 조회수 100만 돌파",미래에셋증권 관계자는 &quot;현재 <b>인공지능</b> 역할이 투자자의 자산배분을 넘어 금융 상품 추천까지 확장되고 있지만 실제로 고객들은 투자결정을 할 때 <b>전문가</b>의 도움을 필요로 하고 있다&quot;며 &quot;투자 경험이 적은 초보... ,http://www.smarttimes.co.kr/news/articleView.html?idxno=16447,http://www.smarttimes.co.kr/news/articleView.html?idxno=16447
29,2024-02-15 15:16:00,"샌즈랩, 구축형 보안 전문 sLLM '샌디' 개발","또한 기존에 사람이 직접 했던 보고서 요약 및 교정, 기업 내 햬킹 대응 정보 검색을 대신 수행할 수 있는 <b>인공지능</b> 사이버 보안 <b>전문가</b>다. 생성형 AI 기반 구축형 사이버보안 모델 샌디 예시 자료 샌즈랩은 그간 사이버... ",http://www.itdaily.kr/news/articleView.html?idxno=220415,http://www.itdaily.kr/news/articleView.html?idxno=220415
30,2024-02-15 15:13:00,"[전자파학회 동계학술대회]전파기술, 양자부터 우주국방까지 영토 확장",행사에는 산·학·연·관 <b>전문가</b>와 학생 등 1200명이 넘는 인원이 참여해 성황을 이뤘다. 대회를 앞두고 471편의... 조원민 책임연구원은 <b>인공지능</b>(AI)을 활용한 레이다 데이터 처리·분석 방안을 제시했다. ◇한국의 IMS 표방... ,https://www.etnews.com/20240215000276,https://n.news.naver.com/mnews/article/030/0003181268?sid=105
31,2024-02-15 15:12:00,"미래에셋證, '이번 주 챙겨볼 금융상품' 조회수 100만 돌파",미래에셋증권 관계자는 &quot;현재 <b>인공지능</b> 역할이 투자자의 자산배분을 넘어 금융 상품 추천까지 확장되고 있지만 실제로 고객들은 투자결정을 할 때 <b>전문가</b>의 도움을 필요로 하고 있다&quot;며 &quot;특히 투자 경험이 적은 초보... ,http://www.greenpostkorea.co.kr/news/articleView.html?idxno=215724,http://www.greenpostkorea.co.kr/news/articleView.html?idxno=215724
32,2024-02-15 15:12:00,"한컴, 임직원 대상 'AI 테크데이' 개최",[사진=한글과컴퓨터] 한글과컴퓨터가 임직원이 한자리에 모여 <b>인공지능</b>(AI) 사업을 논의하고 공유하는 'AI... 외부 <b>전문가</b>와 개발자를 초청해서 한컴의 AI 기술 역량을 향상하는 장으로 활용하겠다&quot;고 말했다. 이어... ,https://www.ajunews.com/view/20240215150932885,https://www.ajunews.com/view/20240215150932885
33,2024-02-15 15:06:00,"곡성군, 행안부 데이터기반행정 평가 3년 연속‘최고등급’","민간<b>전문가</b>로 구성된 점검단은 '데이터기반행정 관리체계'와 '데이터 공동활용', '데이터 분석 및 정책활용... 군에서는 데이터기반행정 역량문화 조성을 위해 데이터 기술의 변화에 따른 <b>인공지능</b> ChatGPT 직원교육과... ",http://www.metroseoul.co.kr/article/20240215500467,http://www.metroseoul.co.kr/article/20240215500467
34,2024-02-15 15:04:00,"하나은행, 여의도에 연금 VIP손님 전문 상담센터 오픈",뿐만 아니라 세무·부동산·상속·증여 등 자산관리 전 분야의 <b>전문가</b>와 연계한 하나은행만의 특화된... 또한 모바일 연금닥터 서비스와 AI(<b>인공지능</b>) 연금투자솔루션 등 비대면 채널에서도 차별화된 자산관리... ,http://www.whitepaper.co.kr/news/articleView.html?idxno=232122,http://www.whitepaper.co.kr/news/articleView.html?idxno=232122
35,2024-02-15 15:02:00,"연세대학교 미래교육원, 비전공자를 위한 '제2기 빅데이터 <b>전문가</b> 과정' 수강...","연세대학교 미래교육원은 '제2기 빅데이터 <b>전문가</b> 과정' 수강생을 모집한다고 밝혔다. 빅데이터와 <b>인공지능</b> 시대가 도래하면서 데이터 분석은 모든 직장인의 고민거리인 동시에 필수적인 과제가 되었고, 이제는 마케팅... ",https://www.imaeil.com/page/view/2024021514301698980,https://n.news.naver.com/mnews/article/088/0000862409?sid=102
36,2024-02-15 14:58:00,"한컴, 'AI 테크데이' 진행…&quot;AI 사업 전략 공유&quot;",사진/한글과컴퓨터 한글과컴퓨터는 임직원이 한자리에 모여 <b>인공지능</b>(AI) 사업을 논의하고 공유하는 'AI... 임직원은 물론 외부 <b>전문가</b>와 개발자를 초청해서 한컴의 AI 기술 역량을 향상하는 장으로 활용하겠다&quot;고 말했다.,http://www.smedaily.co.kr/news/articleView.html?idxno=281769,http://www.smedaily.co.kr/news/articleView.html?idxno=281769
37,2024-02-15 14:56:00,"뷰런테크놀로지, 前 스트라드비젼 CTO 제홍모 전격 영입","이번에 뷰런에서 전격 영입한 제홍모 총괄(52세)은 올라웍스, 인텔코리아, 스트라드비젼 등 20년 이상 국내외에서 현장 경험을 쌓아온 국내 최고 AI(<b>인공지능</b>)분야 <b>전문가</b>중 한 명이다. 특히, 최고기술책임자로... ",https://www.epnc.co.kr/news/articleView.html?idxno=240724,https://www.epnc.co.kr/news/articleView.html?idxno=240724
38,2024-02-15 14:54:00,"한국국학진흥원 부설 한문교육원, 한문 번역 <b>전문가</b> 배출","정종섭 원장은 한문 번역 <b>전문가</b>가 되기 위한 과정을 훌륭히 마친 졸업생들을... <b>인공지능</b> 이 인간의 많은 일과 일자리를 앗아간다고 하지만, 인간의 내적 섬세함과... ",http://www.breaknews.com/1015943,http://www.breaknews.com/1015943
39,2024-02-15 14:54:00,"카카오, 2023년 4분기 실적발표 컨퍼런스콜 전문","최근에는 전 국민이 생활 속에서 <b>인공지능</b>(AI)을 경험할 수 있도록 카카오톡과 AI를 결합하는 실험을... 외부 <b>전문가</b>와 검토 중입니다. 이 부분의 회계처리 변경은 손익에 영향을 미치지 않으며, 3월 중 사업보고서 공시... ",http://www.thelec.kr/news/articleView.html?idxno=25967,http://www.thelec.kr/news/articleView.html?idxno=25967
40,2024-02-15 14:50:00,"샌즈랩, 생성형 AI와 데이터셋으로 보안 산업 기술 혁신의 기준 제시","즉, SANDY는 기존에 사람이 직접 했던 보고서 요약 및 교정, 기업 내 해킹 대응 정보 검색을 대신 수행할 수 있는 <b>인공지능</b> 사이버 보안 <b>전문가</b>이다.샌즈랩 김기홍 대표는 “사이버 위협 인텔리전스와 <b>인공지능</b> 학습용... ",http://www.boannews.com/media/view.asp?idx=126715&kind=,http://www.boannews.com/media/view.asp?idx=126715&kind=
41,2024-02-15 14:50:00,미래에셋생명 변액펀드 '글로벌 MVP60' 누적수익률 70% 돌파,자산배분 <b>전문가</b>가 매 분기 시장상황에 맞춰 펀드간 비중을 조정하며 운용하고 있다. 펀드 변경이... 유지하며 <b>인공지능</b>(AI)을 통해 수익모델을 다양화할 미국 소프트웨어 기업들에 대한 투자비중을 크게 늘렸다.... ,http://www.smedaily.co.kr/news/articleView.html?idxno=281766,http://www.smedaily.co.kr/news/articleView.html?idxno=281766
42,2024-02-15 14:50:00,"샌즈랩, 구축형 sLLM '샌디' 개발…글로벌 기술 개발 강화","있는 <b>인공지능</b> 사이버 보안 <b>전문가</b>이다. 샌즈랩 김기홍 대표는 &quot;사이버 위협 인텔리전스와 <b>인공지능</b> 학습용 데이터셋을 효과적으로 활용하려는 민관의 노력들이 보안 기술의 발전으로 이어지게 되고, 보안 산업의... ",http://www.it-b.co.kr/news/articleView.html?idxno=73725,http://www.it-b.co.kr/news/articleView.html?idxno=73725
43,2024-02-15 14:48:00,새 도약 노리는 귀뚜라미…올해 해외 진출 박차,"최 회장은 “생성형 <b>인공지능</b> 기술이 가져올 사업 전반에 대한 대변화에 적극적으로 대응해 그룹 비전에... 김 대표는 1994년 대우전자에 입사해 폴란드, 독일, 이탈리아, 미국, 중국 등에서 30년간 근무한 해외 <b>전문가</b>로... ",https://www.etoday.co.kr/news/view/2331282,https://www.etoday.co.kr/news/view/2331282
44,2024-02-15 14:46:00,"글로벌 기업 40% &quot;AI 도입, 아직 검토 단계&quot;","IBM 글로벌 AI 도입 지수 2023 표지  지난해 기준 40%의 기업이 <b>인공지능</b>(AI) 도입을 검토 중이며, 42%가... IT <b>전문가</b>를 대상으로 실시한 결과다. 직원이 1,000명 이상인 기업 50%, 5,000명 이상인 기업 50%로 구성된... ",http://www.itdaily.kr/news/articleView.html?idxno=220407,http://www.itdaily.kr/news/articleView.html?idxno=220407
45,2024-02-15 14:44:00,"곡성군, 데이터기반행정 평가 3년 연속 '최고 등급'","민간<b>전문가</b>로 구성된 점검단은 '데이터기반행정 관리체계'와 '데이터 공동활용', '데이터 분석 및 정책활용... 군에서는 데이터기반행정 역량문화 조성을 위해 데이터 기술의 변화에 따른 <b>인공지능</b> 챗GPT 직원교육과 홍보... ",https://daily.hankooki.com/news/articleView.html?idxno=1052049,https://daily.hankooki.com/news/articleView.html?idxno=1052049
46,2024-02-15 14:39:00,北·中·러시아 해커도 챗GPT 활용…오픈AI “확인 뒤 접근 차단”,"북한과 중국, 러시아, 이란 등과 연계된 해커집단들도 생성형 <b>인공지능</b>(AI) 챗GPT를 활용하는 것으로... 다만 일부 <b>전문가</b>들이 우려한 것처럼 해커들이 AI의 힘을 빌려 지금껏 상상하지 못했던 공격법을 창조한 경우는... ",https://biz.chosun.com/it-science/ict/2024/02/15/NLXMYBEVWZHW3OFDRA6K2243FM/?utm_source=naver&utm_medium=original&utm_campaign=biz,https://n.news.naver.com/mnews/article/366/0000970597?sid=105
47,2024-02-15 14:38:00,&quot;생산성 혁신으로 저출산·고령화 극복해야&quot;,"Vehicles), <b>인공지능</b>(Artificial Intelligence) 등 신기술 분야에서 혁신을 주도했던 일본이 현재는 젊은 인재들의... 고숙련 <b>전문가</b>를 활용할 수 있는 직무 분석 및 발굴 등이 필요하다”고 말했다. 해외 전문인력을 국내로... ",https://www.dailian.co.kr/news/view/1328685/?sc=Naver,https://n.news.naver.com/mnews/article/119/0002799892?sid=101
48,2024-02-15 14:34:00,"미래에셋, '이번 주 챙겨볼 금융상품' 조회수 100만 돌파",미래에셋증권 관계자는 '현재 <b>인공지능</b> 역할이 투자자의 자산배분을 넘어 금융 상품 추천까지 확장되고 있지만 실제로 고객들은 투자결정을 할 때 <b>전문가</b>의 도움을 필요로 하고 있다&quot;며 &quot;특히 투자 경험이 적은 초보... ,http://www.newsbrite.net/news/articleView.html?idxno=180807,http://www.newsbrite.net/news/articleView.html?idxno=180807
49,2024-02-15 14:28:00,&quot;삼성전자 살 필요 없네&quot;…75% 오른 반도체 ETF는 어디?,AI(<b>인공지능</b>) 산업이 증시의 주도 테마로 등장하면서 글로벌 반도체 기업들의 주가가 상승했다. 특히 GPU... <b>전문가</b>들은 개별 종목에 투자하는 것보다 유망한 글로벌 반도체 기업을 묶어서 투자할 수 있는 ETF가... ,http://news.mt.co.kr/mtview.php?no=2024021508273928616,https://n.news.naver.com/mnews/article/008/0004999148?sid=101
