cnt,pdate,title,description,org_link,link
487,2024-02-14 08:25:00,"핑거, 중소기업 비즈니스웨어 '파로스' 출시","<b>전문가</b>가 아니더라도 누구나 쉽게 사용이 가능한 통합 서비스다. 재무, 회계·결산, 인사·급여, 금융... 핑거가 지난 23년 간 금융권 핀테크 사업을 통해 쌓아온 AI(<b>인공지능</b>), 빅데이터, 클라우드 기반 기술이 집약된... ",http://www.newsis.com/view/?id=NISX20240214_0002625542&cID=10403&pID=15000,https://n.news.naver.com/mnews/article/003/0012371230?sid=101
488,2024-02-14 08:22:00,"경기도, AI노인 돌봄·주거안전 등 1인 가구 지원책 마련",수원=박성훈 기자 경기도가 <b>인공지능</b>(AI)을 활용해 노인을 돌보는 ‘말벗 서비스’와 주거안전 체크리스트... 도는 또 올해 상반기 안에 주거·안전 <b>전문가</b>와 경기도여성가족재단과 함께 1인 가구의 안전한 집 선택을... ,https://www.munhwa.com/news/view.html?no=2024021401039927042001,https://n.news.naver.com/mnews/article/021/0002621111?sid=102
489,2024-02-14 08:15:00,"경기도, 163만 '1인가구' 지원에 8807억원 투입","<b>전문가</b>, 경기도 여성가족재단 등과 협업해 경기도 특성과 주택 유형 등을 반영한 ‘주거 안전 체크리스트’를 개발해 상반기 중 보급한다. 또 안부 확인이 필요한 65세 이상 1인 노인가구를 대상으로 ‘<b>인공지능</b>(AI)... ",https://view.asiae.co.kr/article/2024021408154299986,https://n.news.naver.com/mnews/article/277/0005379370?sid=102
490,2024-02-14 08:14:00,&quot;일하지 않아도 된다면?&quot;...로봇회사 대표가 꿈꾸는 세상,"국내에서 손꼽히는 로봇 <b>전문가</b>인 김병수 대표. 그는 고려대 전기공학과를 졸업한 뒤 한양대 대학원에서... 별도 통신장치 없이 자체 <b>인공지능</b>(AI)으로 엘리베이터 버튼 조작, 보안카드 태깅 및 객실 노크 등을 수행할 수... ",http://www.edaily.co.kr/news/newspath.asp?newsid=01446486638790520,https://n.news.naver.com/mnews/article/018/0005672668?sid=105
491,2024-02-14 08:14:00,4.10 총선과 가짜뉴스 대처법,세계경제포럼(다보스포럼·WEF)이 발간한 연간리포트 '글로벌 위험보고서 2024'에는 '<b>인공지능</b>이 생성하는... 딥페이크(deepfake) 기술이 더욱 정교해지면서 <b>전문가</b>가 아니면 사실상 식별이 불가능하다. 가짜뉴스로 판별되기... ,https://www.mediaus.co.kr/news/articleView.html?idxno=307939,https://www.mediaus.co.kr/news/articleView.html?idxno=307939
492,2024-02-14 08:11:00,경기도 '163만 1인가구 지원' 8807억원 규모 39개 과제 추진,"경기도가 도내 163만 1인가구를 위해 <b>인공지능</b>(AI) 노인말벗서비스, 주거안전 체크리스트 개발·보급 등... 주거·안전 <b>전문가</b>, 경기도 여성가족재단과 협업해 경기도 특성과 주택유형 등을 반영한 경기도형 '안전한 집... ",https://www.newspim.com/news/view/20240214000031,https://www.newspim.com/news/view/20240214000031
493,2024-02-14 08:08:00,"[오늘의 투자전략] 코스피, 하락 출발 전망…美 1월 CPI 쇼크 영향 클 것","이투데이=손민지 기자 | 14일 증시 <b>전문가</b>는 코스피가 하락 출발할 것으로 전망했다. ◇김석환 미래에셋증권... ◇한지영‧김지현 키움증권 연구원= 전날 국내 증시는 연휴 기간 ARM, 엔비디아 등 <b>인공지능</b>(AI) 중심의 미국... ",https://www.etoday.co.kr/news/view/2330577,https://www.etoday.co.kr/news/view/2330577
494,2024-02-14 08:00:00,"경기도,1인가구 ‘주거·안전·외로움’ 등 39개 과제 추진","주거․안전 <b>전문가</b>, 도 여성가족재단과 협업해 경기도형 ‘안전한 집 선택 사전체크리스트’를 개발하고 상반기 중에 보급할 예정이다. 안부 확인이 필요한 65세 이상 노인을 대상으로 ‘<b>인공지능</b>(AI)... ",https://www.sportsseoul.com/news/read/1398776?ref=naver,https://n.news.naver.com/mnews/article/468/0001030143?sid=102
495,2024-02-14 07:51:00,'희망 미래' 진천군 4차 산업혁명 디지털 미래인재 양성 '박차',마련한 'K-스마트 <b>인공지능</b> 교육센터'에서 4월부터 실시한다. 새로 조성한 쾌적한 환경에서 국내 최고 과학 전문기관인 한국과학기술원(카이스트)의 융합 교육연구센터 <b>전문가</b>와 함께 △주제별 소프트웨어(SW) 교육... ,https://www.psnews.co.kr/news/articleView.html?idxno=2046989,https://www.psnews.co.kr/news/articleView.html?idxno=2046989
496,2024-02-14 07:43:00,[굿모닝경제] 대한항공·아시아나 합병...이제 '메가캐리어'까지 한걸음 남았...,"그래서 지금 시장에서 낙관적으로 보는 <b>전문가</b>들은 빠르면 3월달에도 기준금리 인하가 시작될 수도 있다고... 글로벌 증시에서 <b>인공지능</b> 바람이 막 거세게 불고 있다, 또는 AI 열차라고 묶어서 표현하는 법도 나왔더라고.... ",https://www.ytn.co.kr/_ln/0102_202402140743461867,https://n.news.naver.com/mnews/article/052/0001997543?sid=101
497,2024-02-14 07:22:00,'1월 CPI 쇼크'에 국채금리 급등 속 하락···나스닥 1.8%↓[뉴욕증시 포커스...,"역시 각각 0.3%, 3.7% 상승할 것으로 본 <b>전문가</b> 예상치를 웃돌았다. CPI 가중치의 35%를 차지하는 주거비가... 전날 장중 한때 시가총액 3위 자리에 오른 엔비디아(-0.17%)를 비롯해 AMD(-0.22%), 인텔(-1.98%) 등 <b>인공지능</b>... ",https://www.econovill.com/news/articleView.html?idxno=645639,https://www.econovill.com/news/articleView.html?idxno=645639
498,2024-02-14 07:13:00,"경기도 1인가구, ‘아늑하고 안전한 연결망’ 지원 받는다","경기도가 도내 163만 1인가구를 위해 <b>인공지능</b>(AI) 노인말벗서비스, 주거안전 체크리스트 개발보급 등 올해... 주거안전 <b>전문가</b>, 경기도 여성가족재단과 협업해 경기도 특성과 주택유형 등을 반영한 경기도형 ‘안전한... ",http://news.heraldcorp.com/view.php?ud=20240214050016,https://n.news.naver.com/mnews/article/016/0002266062?sid=100
499,2024-02-14 06:31:00,AI VS AI...안방 TV 업그레이드 전쟁 시작,보다 강력해진 <b>인공지능</b>(AI) 기능을 탑재한 TV의 출현으로 '안방극장 업그레이드'가 본격화하고 있다.... LG 올레드 TV도 영상 <b>전문가</b> 및 글로벌 매체들로부터 좋은 평가를 받고 있다. 넷플릭스 드라마 '성난 사람들... ,http://news.mt.co.kr/mtview.php?no=2024021315151022898,https://n.news.naver.com/mnews/article/008/0004998209?sid=101
500,2024-02-14 06:25:00,"호재가 모조리 반영된 지수, 물가악재 출현에 휘청 [뉴욕마감]",헤드라인 지표와 근원 지표 모두 <b>전문가</b> 기대치를 상회하는 수준으로 결과가 집계되면서 물가하락이 역시... <b>인공 지능</b>(AI)과 비만 치료제에 대한 소문이 시장 가치 창출의 핵심이었고 이런 기대감이 지수에 충분히... ,http://news.mt.co.kr/mtview.php?no=2024021406152836467,https://n.news.naver.com/mnews/article/008/0004998203?sid=101
501,2024-02-14 06:24:00,"국내 통신사, MWC서 기술<b>전문가</b> 앞세워 6G·AI 전략 공개","국내 통신사, MWC서 기술<b>전문가</b> 앞세워 6G·AI 전략 공개 국내 통신업계가 약 2주 앞으로 다가온 세계 최대 이동통신 박람회인 ‘모바일월드콩그레스(MWC 2024)’에 참석해 차세대 통신(6G)·<b>인공지능</b>(AI) 등 미래... ",https://www.viva100.com/main/view.php?key=20240213010003388,https://www.viva100.com/main/view.php?key=20240213010003388
502,2024-02-14 06:20:00,중국발 리스크에 규제 강화까지 게임업계 곡소리…&quot;지원안 곧 나온다&quot; 진화,"14일 업계에 따르면 문체부는 현재 학계·법조계 <b>전문가</b>들이 포함된 테스크포스(TF)를 운영 중이다. '게임업계... 필요하다&quot;며 &quot;챗GPT, <b>인공지능</b>(AI) 등 신기술이 등장하면서 신입 직원들의 취업이 막혀있는데, 중소형 게임사의... ",https://www.news1.kr/articles/5319216,https://n.news.naver.com/mnews/article/421/0007349244?sid=105
503,2024-02-14 06:03:00,"올트먼 9300조원 모집…AI 반도체 시장, 판 흔들린다",국내 반도체 업계와 <b>전문가</b>들은 올트먼의 투자 유치 행보가 전세계 <b>인공지능</b> 반도체 시장의 크기를 키우는 동시에 한국 기업에도 긍정적인 영향을 미칠 것이라고 봤다. 이름을 밝히길 꺼린 반도체 업계 관계자는 “샘... ,https://www.hani.co.kr/arti/economy/global/1128236.html,https://n.news.naver.com/mnews/article/028/0002676756?sid=101
504,2024-02-14 05:50:00,"실적 반등 절실한 줌인터넷… 김남현 대표, 미래 먹거리 발굴 과제",김남현 대표는 미디어 및 모바일 시장에서 여러 성과를 거둔 <b>전문가</b>로 실적 부진에 빠진 줌인터넷의... 최근까지는 콘텐츠 커머스 스타트업 '패스트뷰'와 '뉴스픽'을 운영하는 <b>인공지능</b>(AI) 미디어 스타트업 '노티플러스... ,https://www.moneys.co.kr/article/2024021312094226441,https://n.news.naver.com/mnews/article/417/0000981457?sid=105
505,2024-02-14 05:46:00,외국인이 쏘아올린 밸류업…7거래일간 K증시 6조 폭풍매수,증시 <b>전문가</b>들은 최근 외국인투자가가 대형주는 물론 코스닥에 선물 상품까지 매집하고 있다는 점에서... 미국에서 불어온 반도체 설계자산(IP) 업체 ARM발 <b>인공지능</b>(AI) 특수 기대감도 한몫했지만 정부의 밸류업... ,https://www.sedaily.com/NewsView/2D5CUI8XGD,https://n.news.naver.com/mnews/article/011/0004299154?sid=101
506,2024-02-14 05:04:00,"120년 만에 경부선 철도 지하화… 하나의 영등포, 4차 산업 ‘일등포’ [2024...","<b>전문가</b>와 주민 의견을 담은 미래 청사진을 그려 ‘하나의 영등포’로 재탄생하는 마스터플랜을 마련할... <b>인공지능</b>(AI) 특화 과학고와 카이스트 서울 캠퍼스 등을 유치해 청소년들을 과학 인재로 양성하고, 4차 산업의... ",https://www.seoul.co.kr/news/newsView.php?id=20240214014002&wlog_tag3=naver,https://n.news.naver.com/mnews/article/081/0003430189?sid=102
507,2024-02-14 05:03:00,정보 수집 통제·워터마크까지… 세계는 ‘AI 목에 방울 달기’ 전쟁 [AI 블랙...,기저에는 <b>인공지능</b>(AI)이 인류에 번영을 가져다 줄 것이라고 생각하는 ‘부머’(Boomer)와 생존을 위협하게... EU 집행위원회는 누구도 AI 규제에 별다른 관심이 없던 2018년부터 <b>전문가</b> 수천 명의 의견을 수렴해 2021년 4월... ,https://www.seoul.co.kr/news/newsView.php?id=20240214008002&wlog_tag3=naver,https://n.news.naver.com/mnews/article/081/0003430178?sid=101
508,2024-02-14 05:02:00,"[<b>전문가</b> 기고] 관세 행정의 미래, 디지털로 디자인한다",아주경제=고광효 관세청장 고광효 관세청장 최근 <b>인공지능</b>(AI)으로 대표되는 디지털 기술의 발전은 민간과 공공 구분 없이 사회 전반에 디지털 전환을 가속하고 있다. 디지털 전환이란 단순히 아날로그를 디지털로 바꾸는... ,https://www.ajunews.com/view/20240213094504826,https://www.ajunews.com/view/20240213094504826
509,2024-02-14 05:01:00,[스타트업 리포트]'딥테크 넘어 딥소트 물결 온다' 에피카 과학자문 맡은 이관...,"<b>인공지능</b>(AI)이 아무리 발달해도 해결할 수 없는 것들이 있다. 가난과 기근, 각종 갈등을 넘어선 사회통합... 전문 지식이 없는 소비자들은 <b>전문가</b>가 자동차 추천부턴 등록, 보험 가입까지 한꺼번에 해주기를 원하죠. 또... ",https://www.hankookilbo.com/News/Read/A2024021210560000988?did=NA,https://n.news.naver.com/mnews/article/469/0000785239?sid=105
510,2024-02-14 05:00:00,강세장 진입 vs 붕괴 그림자 '엇갈린 예측',AI(<b>인공지능</b>) 혁명이 일부 기업들의 실적 성장세로 이어지면서 최근 미국 증시에서는 1990년대 닷컴 버블과 현재 상황에 대한 비교가 주목받는다. 회의론자들은 현재 AI 붐이 이미 버블 조짐을 보인다며 붕괴 우려를... ,http://news.mt.co.kr/mtview.php?no=2024021322154738373,https://n.news.naver.com/mnews/article/008/0004998155?sid=101
511,2024-02-14 04:31:00,&quot;절반 이상이 인건비인데&quot; &quot;학생 수 줄어드는데&quot; 교육교부금 개편 방향 시각차,"다만 학령인구 감소, <b>인공지능</b>(AI) 교육 강화 등 다차원 격변기에 적정한 교육재정 규모를 두고 관계부처는 물론 <b>전문가</b> 간에도 입장이 엇갈리다 보니, 이들 대안도 서로 방향차가 뚜렷하다. 그럼에도 학생·학급 등 교육... ",https://www.hankookilbo.com/News/Read/A2024013015300000205?did=NA,https://n.news.naver.com/mnews/article/469/0000785222?sid=102
512,2024-02-14 04:31:00,“약 1경 모아 AI칩 직접 만들겠다” 샘 올트먼의 기염에…<b>전문가</b>들 “우리에...,"생성형 <b>인공지능</b>(AI) '챗GPT'를 만든 오픈AI의 최고경영자(CEO) 샘 올트먼이 자체 AI 반도체 공급망 구축을... <b>전문가</b>들은 &quot;우리 기업에 기회가 될 것&quot;이라면서도 관련 규제 점검, 인력 양성 등 정부의 촘촘한 지원이... ",https://www.hankookilbo.com/News/Read/A2024021316200002402?did=NA,https://n.news.naver.com/mnews/article/469/0000785224?sid=101
513,2024-02-14 04:12:00,발렌타인데이 앞두고 데이트 앱 ‘로맨스 봇 스캠’ 경고,"특히, 갈수록 더 많은 사기범들이 봇, <b>인공지능</b>(AI) 등을 이용해 피해자들을 속이고 있는 것으로 나타났다.... <b>전문가</b>들은 상대방이 너무 형식적이거나 대화형이 아닌 메시지를 보내거나 일관성이 없는 정보들을 말할... ",https://www.radiokorea.com/news/article.php?uid=438045,https://www.radiokorea.com/news/article.php?uid=438045
514,2024-02-14 04:01:00,'트럼프 2.0' 행정부 교과서 '프로젝트 2025'에는 뭐가 담겼나?,"트럼프의 사법 리스크가 갈수록 심각해지고 있지만 여전히 대다수 <b>전문가</b>들은 트럼프가 미 공화당 대선... 2020년 10월 캘리포니아에 설립된 DZYNE는 <b>인공지능</b>(AI) 기반 자율항공기 전문 기업으로 자율주행차, 상용... ",http://weekly.chosun.com/news/articleView.html?idxno=32068,https://n.news.naver.com/mnews/article/053/0000041508?sid=104
515,2024-02-14 03:07:00,"문화체육관광부-한국문화예술교육진흥원, 유네스코 세계대회 참가 및 한국 부...","그간 한국은 2022년 국제 <b>전문가</b> 회의, 2023년 파리 다자회담 한국 주도 행사 개최 등 유네스코의... 및 <b>인공지능</b>과 문화예술교육 ▲문화예술교육 파트너십 구축 ▲연구·모니터링 등이다. 13일 한국 주도의... ",http://sports.khan.co.kr/news/sk_index.html?art_id=202402140306003&sec_id=560801&pt=nv,https://n.news.naver.com/mnews/article/144/0000943202?sid=106
516,2024-02-14 03:03:00,"“<b>인공지능</b> 벤처기업, 광주에 모여라”",광주경제자유구역청이 <b>인공지능</b>(AI) 관련 지식산업센터 건립을 추진한다. 광주경제자유구역청은 첨단3지구... AI <b>전문가</b> 자문단 의견을 반영하기로 했다. AI 벤처기업의 비즈니스 활성화를 위해 인근에 건립하고 있는 AI... ,https://www.donga.com/news/Society/article/all/20240213/123504680/1,https://n.news.naver.com/mnews/article/020/0003547799?sid=102
517,2024-02-14 01:59:00,입체적 사업 다각화로 새로운 성장 모색하는 바이오 헬스케어 기업들,이번 협약은 ‘비전프로 딥러닝 및 LMM을 활용한 <b>인공지능</b> 기반의 영상분석 시스템’에 대한 협력사업... 벳플은 동아제약의 수의사들과 <b>전문가</b>가 직접 개발에 참여한 반려동물 맞춤 영양제로 강아지와 고양이를 위한... ,http://sports.khan.co.kr/news/sk_index.html?art_id=202402140158003&sec_id=560101&pt=nv,https://n.news.naver.com/mnews/article/144/0000943195?sid=103
518,2024-02-14 00:11:00,"나홀로 호황 미국, 숨은 비결 ‘일잘러’였다",이러한 미국의 노동생산성 향상은 <b>인공지능</b>(AI) 산업의 출현으로 더 가속화 할 수 있다. 다만 <b>전문가</b>들은 최근 미국의 노동생산성 향상에는 유연한 노동시장이 더 근본적 원인이라고 지적한다. 고용시장이 경직적인... ,https://www.joongang.co.kr/article/25228482,https://n.news.naver.com/mnews/article/025/0003341171?sid=101
519,2024-02-14 00:04:00,"콘진원, NCA 수료생 성과 선보이는 쇼케이스 개최","자리로, <b>전문가</b> 평가 및 프로젝트를 직접 체험한 참관객 투표를 통해 분야별 우수 프로젝트를 선정한다.... ▲3D 애니메이션 '호문클루스'의 1987 ▲단편영화 '지붕 위의 질투'의 50그램 ▲<b>인공지능</b> 음악영화 '삭제된... ",https://www.thedailypost.kr/news/articleView.html?idxno=103566,https://www.thedailypost.kr/news/articleView.html?idxno=103566
520,2024-02-14 00:04:00,[한국자동차연구원 천안·아산 강소특구 이노폴리스캠퍼스 CEO] 모빌리티 사고...,"“국내의 경우, <b>인공지능</b> 기술실증 테스트베드 조성사업에 참여해 대전광역시 시민들의 안전과 신속한... 선정된 창업자에게는 기본·심화 역량 과정의 창업교육을 진행하며 분야별 <b>전문가</b> 멘토링을 통한 창업코칭의... ",https://magazine.hankyung.com/job-joy/article/202402141362d,https://magazine.hankyung.com/job-joy/article/202402141362d
521,2024-02-14 00:02:00,[속보] 뉴욕증시 비트코인 &quot; 대폭락 신호탄&quot; CPI 물가 예상밖 FOMC 금리인하 ...,"오픈에이아이(OpenAI) 공동창업자 겸 최고경영자(CEO) 샘 올트먼이 자체 <b>인공지능</b>(AI) 반도체 개발을 위해... 월스트리트저널(WSJ)은 주가의 높낮이를 판단할 때 <b>전문가</b>들은 경제 상황, 회사의 전반적인 재무 건전성... ",http://www.g-enews.com/ko-kr/news/article/news_all/2024021210050966064a01bf698f_1/article.html,http://www.g-enews.com/ko-kr/news/article/news_all/2024021210050966064a01bf698f_1/article.html
522,2024-02-13 23:19:00,"‘AI 활용 의료제품’, 한국이 주도권 쥐려면[기고/오유경]","2022년 11월 선보인 생성형 <b>인공지능</b>(AI) 챗GPT는 인류에 새로운 충격을 줬다. 챗GPT는 진지한 대화를 할 수 있을... 이 심포지엄에는 유럽연합(EU), 독일, 일본, 사우디아라비아 등 20여 개국 규제 당국과 업계 및 학계 <b>전문가</b>... ",https://www.donga.com/news/Opinion/article/all/20240213/123504318/1,https://n.news.naver.com/mnews/article/020/0003547738?sid=110
523,2024-02-13 22:00:00,"K바이오·헬스케어, '입체적 사업 다각화'로 新성장동력 발굴 나선다",벳플은 동아제약의 수의사들과 <b>전문가</b>가 직접 개발에 참여한 반려동물 맞춤 영양제로 강아지와 고양이를... 이번 협약은 '비전프로 딥러닝 및 LMM을 활용한 <b>인공지능</b> 기반의 영상분석 시스템'에 대한 협력사업 확장을... ,http://www.enewstoday.co.kr/news/articleView.html?idxno=2089588,http://www.enewstoday.co.kr/news/articleView.html?idxno=2089588
524,2024-02-13 21:22:00,수원 ‘기업펀드’ 1년 만에 목표액 3배 달성,"<b>인공지능</b>(AI) 등 4차산업 분야를 맡은 아주IB투자(1000억원), 소부장 분야의 코오롱인베스트먼트(730억원)... 시는 운용사와 투자협약을 맺어 펀드의 틀을 갖춰 놓은 뒤 <b>전문가</b>들이 투자기업을 발굴하도록 돕는 역할을... ",http://www.segye.com/newsView/20240213516198?OutUrl=naver,https://n.news.naver.com/mnews/article/022/0003903950?sid=102
525,2024-02-13 21:10:00,디지털융합교육원 '제2기 생성형 AI 프롬프트 엔지니어 민간자격증 과정' 개최,"본 과정에는 최재용 원장 스마트융합컨설팅학과 겸임교수, 이신우 프롬프트 엔지니어 <b>전문가</b> 가 참여해 <b>인공지능</b> 언어를 정복하는 커리큘럼을 제공할 예정이다. 마지막 세션에서는 프롬프트 활용 실습 사례 발표와... ",http://www.fntoday.co.kr/news/articleView.html?idxno=313967,http://www.fntoday.co.kr/news/articleView.html?idxno=313967
526,2024-02-13 21:02:00,거대한 물결 ‘하이브리드 워크’···美 실리콘밸리선 ‘재택+사무실’ 뉴노...,"글로벌 경기 침체로 실적이 악화된 데다 <b>인공지능</b>(AI) 확산으로 불필요한 인력이 늘어 직원 구조조정이... 아는 <b>전문가</b>로 손꼽힌다. Q. 실리콘밸리에서 하이브리드 근무가 확산되는 배경은 뭘까. A. 구글, 아마존 같은... ",https://www.mk.co.kr/article/10935044,https://n.news.naver.com/mnews/article/024/0000087447?sid=101
527,2024-02-13 20:06:00,국내 대표 사이버위협 인텔리전스 컨퍼런스 'K-CTI 2024'…700여 명 보안담당...,"파고네트웍스 권영목 대표는 사일런스 EPP와 센티넬원 EPP/EDR, 스텔라사이버 오픈 XDR 등을 통합해 <b>인공지능</b>... 익스웨어랩스 윤영 대표는 국내 대표적인 OSINT 위협 인텔리전스 <b>전문가</b>다. 이 자리에서 그는 최근 사이버... ",https://www.dailysecu.com/news/articleView.html?idxno=153511,https://www.dailysecu.com/news/articleView.html?idxno=153511
528,2024-02-13 19:30:00,충북 미래먹거리 반도체산업 집중육성,반도체 <b>전문가</b> 포럼 등 다양한 사업을 내용으로 한다. 최근 반도체산업 환경은 산업의 트랜드의 급변화와 생성형<b>인공지능</b>(AI)의 확산으로 <b>인공지능</b>반도체 시장 성장과 함께 초고속 메모리반도체 고대역폭메모리(HBM)... ,https://www.ccdn.co.kr/news/articleView.html?idxno=960094,https://www.ccdn.co.kr/news/articleView.html?idxno=960094
529,2024-02-13 19:06:00,"한국콘텐츠진흥원, 'NCA 프로젝트 쇼케이스' 개최",<b>전문가</b> 평가 및 프로젝트를 직접 체험한 참관객 투표를 통해 분야별 우수 프로젝트를 선정한다.... △3D 애니메이션 '호문클루스'의 1987 △단편영화 '지붕 위의 질투'의 50그램 △<b>인공지능</b> 음악영화 '삭제된 세계'의... ,https://www.news2day.co.kr/article/20240213500176,https://www.news2day.co.kr/article/20240213500176
530,2024-02-13 18:52:00,"이호원 삼성전자 그룹장, 2월 엔지니어상 받아",모 CTO는 주차관제 제조 분야 <b>전문가</b>로 <b>인공지능</b>(AI) 기술을 활용한 주차관제 시스템과 위치 조정 기능을 갖춘 스마트 무인정산기를 개발했다. 대한민국 엔지니어상은 산업현장의 기술혁신을 장려하고 기술자를... ,https://www.hankyung.com/article/2024021308351,https://n.news.naver.com/mnews/article/015/0004947956?sid=105
531,2024-02-13 18:44:00,"[이태식의 과학2030] AI 미래, 인간 선택에 달렸다","지난해 3월 일론 머스크, 스티브 워즈니악 등 1000명 넘는 기술 <b>전문가</b>들이 대화형 <b>인공지능</b> '챗GPT' 등 첨단 AI 개발을 6개월 동안 중지하라는 공개서한을 발표했다. 또한 5월에는 오픈AI의 최고경영자(CEO) 샘 올트먼 등... ",http://www.fnnews.com/news/202402131844118951,https://n.news.naver.com/mnews/article/014/0005141703?sid=110
532,2024-02-13 18:40:00,"MS, 오픈AI 업고 클라우드서 아마존 성장세 추월...&quot;4분의 3까지 추격&quot;",마이크로소프트(MS)가 클라우드 서비스에 <b>인공지능</b>(AI)을 앞세워 맹추격하고 있기 때문이다. CNBC는 12일... 하지만 <b>전문가</b>들은 MS 애저 클라우드가 훨씬 빠르게 성장할 것으로 내다봤다. AWS가 애저에 맞설 모델을... ,https://www.aitimes.com/news/articleView.html?idxno=157138,https://www.aitimes.com/news/articleView.html?idxno=157138
533,2024-02-13 18:32:00,AI시장 훈풍에 삼성전자-SK하이닉스 회복세 '본격화’,<b>인공지능</b>(AI) 바람을 타고 국내 반도체 업계 회복이 본격화되고 있다. 감산 효과에 이어 AI로 인한 수요가... <b>전문가</b>들은 삼성전자와 SK하이닉스의 감산 조치와 AI로 인한 수요 증가 등이 복합적으로 맞물리면서 가격... ,http://www.g-enews.com/ko-kr/news/article/news_all/2024021315245321526ed0c62d49_1/article.html,http://www.g-enews.com/ko-kr/news/article/news_all/2024021315245321526ed0c62d49_1/article.html
534,2024-02-13 18:23:00,엔비디아·MS 등 빅테크 '엄지척'... 일라이릴리·버크셔·팔로알토 주목,주식 <b>전문가</b>들은 유망한 해외주식을 추천한다. <b>인공지능</b>(AI) 관련 빅테크들이 많은 추천을 받았지만 당장은 주목받지 못한 종목들 장기적으로는 투자할 만하다는 조언이다. 파이낸셜뉴스가 13일 증권사 주요... ,http://www.fnnews.com/news/202402131822425986,https://n.news.naver.com/mnews/article/014/0005141661?sid=101
