cnt,pdate,title,description,org_link,link
244,2024-02-15 06:45:00,"뉴욕증시, 급락 하루 만에 반등…나스닥 1.3%↑마감","뉴욕증시 <b>전문가</b>들은 이날 반등에도 증시의 조정 위험이 상당히 높아진 상황이라고 지적했다.... 그는 여기에 예상보다 강한 실적과 <b>인공지능</b>(AI) 낙관론이 랠리의 주요 동인이었지만, 매그니피센트7 종목의... ",https://www.yna.co.kr/view/AKR20240215012400009?input=1195m,https://n.news.naver.com/mnews/article/001/0014505843?sid=101
245,2024-02-15 06:32:00,미국 고용열기에도 일부업계 왜 해고폭풍 몰아치나 ‘전략적 구조조정’,AI <b>인공지능</b> 발전에 따른 전략적 전환 때문이라는 분석이 나왔다 미국에서 새해 첫달인 1월의 실업률이 3.7%에서 그대로 유지되고 한달에 일자리를 무려 35만 3000개나 늘리는 고용열기를 보였다 <b>전문가</b>들의 예상치 18만... ,https://www.radiokorea.com/news/article.php?uid=438140,https://www.radiokorea.com/news/article.php?uid=438140
246,2024-02-15 06:22:00,"“北해커 ‘킴수키’, 해킹 때 MS·오픈AI 제품 활용”",북한 정찰총국 연계 해커조직 ‘킴수키’가 생성형 <b>인공지능</b>(AI) 챗GPT 개발사 오픈AI와 마이크로소프트(MS) 제품을 활용해 온 사실이 공식 확인됐다. 킴수키는 정보 수집을 위한 공격 대상 싱크탱크와 <b>전문가</b>를 식별하고... ,https://www.kmib.co.kr/article/view.asp?arcid=0019165213&code=61131111&cp=nv,https://n.news.naver.com/mnews/article/005/0001674161?sid=104
247,2024-02-15 06:04:00,北·中·러시아 해커도 챗GPT 활용한다,"북한과 중국, 러시아, 이란 등과 연계된 해커집단들도 생성형 <b>인공지능</b>(AI) 챗GPT를 활용하는 것으로... 다만 일부 <b>전문가</b>들이 우려한 것처럼 해커들이 AI의 힘을 빌려 지금껏 상상하지 못했던 공격법을 창조한 경우는... ",http://www.wowtv.co.kr/NewsCenter/News/Read?articleId=A202402150016&t=NN,https://n.news.naver.com/mnews/article/215/0001148483?sid=104
248,2024-02-15 05:49:00,北·中·러시아 해커도 챗GPT 활용…오픈AI &quot;확인 뒤 접근 차단&quot;,생성형 <b>인공지능</b>(AI) 챗GPT를 활용하는 것으로 확인됐다. 14일(현지시간) 뉴욕타임스(NYT)에 따르면 챗GPT... 다만 일부 <b>전문가</b>들이 우려한 것처럼 해커들이 AI의 힘을 빌려 지금껏 상상하지 못했던 공격법을 창조한 경우는... ,https://www.yna.co.kr/view/AKR20240215006600072?input=1195m,https://n.news.naver.com/mnews/article/001/0014505791?sid=104
249,2024-02-15 05:08:00,[속보] 뉴욕증시 엔비디아 또 폭발 …아마존 이어 구글 꺾고 시가총액 3위,<b>인공지능</b>(AI) 붐 속에서 회사가 생산하는 첨단 반도체 칩 수요가 계속 증가하며 엔비디아의 주가는 2023년중... 뉴욕증시 <b>전문가</b>들은 엔비디아의 4분기 순이익이 113억8000만 달러로 1년 전보다 400%나 급증했을 것으로... ,http://www.g-enews.com/ko-kr/news/article/news_all/2024021505021462294a01bf698f_1/article.html,http://www.g-enews.com/ko-kr/news/article/news_all/2024021505021462294a01bf698f_1/article.html
250,2024-02-15 05:05:00,아마존 제친 엔비디아… 기술 혁신 위력 보였다,<b>인공지능</b>(AI) 반도체 시장을 선점한 엔비디아가 미국 증시에서 아마존을 제치고 시가총액 4위에 올랐다.... 게 <b>전문가</b>들 설명이다. 김양팽 산업연구원 전문연구원은 “미국은 전통적인 팹리스(반도체 설계 전문)... ,https://www.seoul.co.kr/news/newsView.php?id=20240215017009&wlog_tag3=naver,https://n.news.naver.com/mnews/article/081/0003430481?sid=101
251,2024-02-15 05:02:00,美물가상승률 2%대 진입 불발…韓증시 '상승 랠리' 멈추나,미국 월스트리트저널(WSJ)이 집계한 <b>전문가</b>들의 물가상승률 예상치는 2.9%였다. 연준이 기준금리 결정... 지난달 말부터 이번 미국 물가 발표 직전까지 AI(<b>인공지능</b>) 관련주와 저PBR(주가순자산비율)주가 이끄는 국내... ,https://www.nocutnews.co.kr/news/6095587,https://n.news.naver.com/mnews/article/079/0003863655?sid=101
252,2024-02-15 05:02:00,"이통3사, 인간과 협업하는 AI에 꽂히다",먹거리인 <b>인공지능</b>(AI) 중심으로 사업구조를 재편하고 있다. 특히 인간의 업무를 도와 업무 생산성을... 글로벌 AI 도입 지수를 발표하는 IBM Global AI Adoption Index 2023'에 따르면 대기업 IT <b>전문가</b>의 42%는 AI를... ,https://www.etoday.co.kr/news/view/2330884,https://www.etoday.co.kr/news/view/2330884
253,2024-02-15 04:08:00,"美 1월 소비자물가 3.1% 상승… 연준, 금리인하 5월→6월 지연",시장 <b>전문가</b>들은 연준의 금리 인하 기대 시점을 기존 5월에서 6월로 바꿔 잡았다. 영국계 투자은행... 하락 장세 속에 ‘<b>인공지능</b>(AI) 대장주’ 엔비디아는 아마존을 제치고 시총 4위로 올라섰다. 종가 기준... ,https://www.kmib.co.kr/article/view.asp?arcid=0924344045&code=11151100&cp=nv,https://n.news.naver.com/mnews/article/005/0001674136?sid=101
254,2024-02-15 03:25:00,"질주하는 엔비디아, 장중 알파벳 추월해 美 시총 3위",<b>인공지능</b>(AI) 붐 속에서 회사가 생산하는 첨단 반도체 칩 수요가 계속 증가하며 엔비디아의 주가는 지난... <b>전문가</b>들은 엔비디아의 4분기 순이익이 113억8000만 달러로 1년 전보다 400%나 급증했을 것으로 예상한다.... ,https://www.newspim.com/news/view/20240215000004,https://www.newspim.com/news/view/20240215000004
255,2024-02-15 03:03:00,“AI가 어르신 안부 묻고 말벗 되어드려요”,"65세 이상 어르신을 대상으로는 ‘<b>인공지능</b>(AI) 노인말벗서비스’를 추진한다. 홀몸노인과 차상위... 위해 <b>전문가</b>들과 주택, 청년, 노인 등 도내 15개 부서가 협업해 시행계획을 마련했다”고 말했다. ● 병원 안심... ",https://www.donga.com/news/Society/article/all/20240215/123523449/1,https://n.news.naver.com/mnews/article/020/0003548025?sid=102
256,2024-02-15 03:02:00,美 물가 쇼크에 엔화 환율 ‘심리 저항선’ 150엔선 붕괴,3.1%로 예상치 웃돌자 ‘强달러’로 미국의 1월 소비자물가가 전년보다 3.1% 올라 <b>전문가</b> 예상인 2.9%를... 재택 근무 확산에 더해 <b>인공지능</b>(AI) 도입으로 해고가 이어지면서 미국에선 사무실 공실이 해소되지 않고 있다.... ,https://www.chosun.com/economy/economy_general/2024/02/15/7KVOL24VDNCLLPQLBANG6XCXG4/?utm_source=naver&utm_medium=referral&utm_campaign=naver-news,https://n.news.naver.com/mnews/article/023/0003816701?sid=101
257,2024-02-15 00:33:00,[취재수첩] 시대 조류 거역하는 AI 포비아,지난 12일 밤 미국 샌프란시스코 차이나타운에서 구글의 <b>인공지능</b>(AI) 기반 자율주행 로보택시 웨이모 한... <b>전문가</b>들은 섣불리 ‘AI 포비아’(공포증)에 빠져서는 안 된다고 지적한다. AI 개발 분야의 ‘4대 천왕’으로... ,https://www.hankyung.com/article/2024021437551,https://n.news.naver.com/mnews/article/015/0004948521?sid=110
258,2024-02-15 00:02:00,뉴욕증시 비트코인 &quot;CPI 물가 쇼크 탈출&quot;,<b>인공지능</b>(AI) 대장주'로 꼽히는 엔비디아가 미국 뉴욕증시에서 종가 기준으로 아마존을 제치고 시가총액... 뉴욕증시 <b>전문가</b>들은 인플레이션이 예상만큼 빠르게 둔화하지 않는다면 연준이 동결 기조를 예상보다... ,http://www.g-enews.com/ko-kr/news/article/news_all/2024021410313391104a01bf698f_1/article.html,http://www.g-enews.com/ko-kr/news/article/news_all/2024021410313391104a01bf698f_1/article.html
259,2024-02-14 23:54:00,"이종식 국민의힘 송파병 예비후보, 첨단화를 통한 재건축 재개발 공약","이종식 국민의힘 송파병 예비후보 이종식 국민의힘 송파병 예비후보는 4차산업경제<b>전문가</b>이자 HCI... 핵심인 <b>인공지능</b>, 반도체, 사물인터넷(IoT), 로봇기술, 자율주행, 가상현실(VR), 3D프린팅 등을 기반으로 한 첨단과학기술... ",http://www.tournews21.com/news/articleView.html?idxno=66998,http://www.tournews21.com/news/articleView.html?idxno=66998
260,2024-02-14 23:34:00,‘목소리 톤’으로 구사하는 설득의 기술[DBR Insight],이런 이유로 최근 많은 <b>전문가</b>들이 집중하는 영역은 바로 목소리 톤이다. 음색이 설득 과정에 중요한 영향을... 연구 결과는 <b>인공지능</b>(AI)이 음성을 제작하거나 분석해 주는 등 다양한 시도가 일어나는 오늘날 디지털... ,https://www.donga.com/news/Opinion/article/all/20240214/123522691/1,https://n.news.naver.com/mnews/article/020/0003547981?sid=110
261,2024-02-14 23:22:00,[해외ESG트렌드] 미국 ESG 채용 붐 시대 재조정기 접어들어,"생성형 <b>인공지능</b>, 지정학적 불확실성 등 이슈에 더 중점을 두고 관망하는 분위기다. 기후변화, 친환경... ESG 경영 및 친환경 비즈니스 분야 <b>전문가</b>들 또한 기업들이 투자자와 주주들에게 수익률 실적을 입증해야... ",https://www.greened.kr/news/articleView.html?idxno=311461,https://www.greened.kr/news/articleView.html?idxno=311461
262,2024-02-14 21:24:00,"삼성전자, 경력사원 대거 채용","삼성전자가 <b>인공지능</b>(AI)과 반도체, 가전, 전장(자동차 전기·전자 장비) 등 거의 전 분야에 걸쳐 경력사원을... 맡을 <b>전문가</b>를 모집한다. 2년 이상의 AI, 머신러닝, 데이터 분석 업무 경험자와 중앙처리장치(CPU) 관련... ",http://www.econotelling.com/news/articleView.html?idxno=12945,http://www.econotelling.com/news/articleView.html?idxno=12945
263,2024-02-14 21:16:00,"삼성전자, '초격차 경쟁력' 확보에 박차…경력사원 대거 채용","삼성전자가 <b>인공지능</b>(AI)과 반도체, 가전, 전장(자동차 전기·전자 장비) 등 사실상 전 분야에서 경력사원을... 맡을 <b>전문가</b>를 모집한다. 2년 이상의 AI, 머신러닝, 데이터 분석 업무 경험자와 중앙처리장치(CPU) 관련... ",https://www.goodnews1.com/news/articleView.html?idxno=431718,https://www.goodnews1.com/news/articleView.html?idxno=431718
264,2024-02-14 21:14:00,도 1인 가구 지원에 8807억 투입 병원 안심동행·AI 말벗 등 서비스,"주거·안전 <b>전문가</b>, 경기도여성가족재단과 협업해 경기도 특성과 주택유형 등을 반영한 경기도형 '안전한 집 선택 사전체크리스트'를 개발하고 상반기 중에 보급할 예정이다. 65세 이상 노인을 대상으로 '<b>인공지능</b>(AI)... ",http://www.kihoilbo.co.kr/news/articleView.html?idxno=1072820,http://www.kihoilbo.co.kr/news/articleView.html?idxno=1072820
265,2024-02-14 20:58:00,"정부 '반도체·2차전지' 승부수…TK, 인재로 파이 키워라","특히 생성형 <b>인공지능</b>(AI) '챗GPT'를 만든 오픈 AI의 최고경영자(CEO) 샘 올트먼이 자체 AI 반도체 공급망 구축을... <b>전문가</b>들은 &quot;우리 기업에 기회가 될 것&quot;이라면서도 관련 규제 점검, 인력 양성 등 정부의 촘촘한 지원이... ",https://www.imaeil.com/page/view/2024021420571146802,https://n.news.naver.com/mnews/article/088/0000862304?sid=101
266,2024-02-14 20:50:00,"상주시 내서면 이장협, 첨단 농업현장 견학","빅데이터, <b>인공지능</b> 등 첨단기술을 활용한 미래 첨단 농업시설을 견학하고 정보를 공유하는 시간을 가졌다.... 농업인들이 <b>전문가</b>로서 내서면에 자리를 잡았으면 한다”고 소감을 밝혔다. 윤태경 내서면장은 “주민과... ",http://www.ksmnews.co.kr/news/view.php?idx=468010,http://www.ksmnews.co.kr/news/view.php?idx=468010
267,2024-02-14 20:46:00,[월드 이슈] 5월 금리 인하 물건너 가나…비트코인은 ‘선전’,뉴욕증시 <b>전문가</b>들은 인플레이션이 빠르게 둔화하지 않는다면 연방준비제도가 기준 금리 동결 기조를... <b>인공지능</b> 기술에 대한 기대감으로 AI의 대표적인 주식인 엔비디아는 종가 기준으로 아마존을 제치고 시가총액... ,https://news.kbs.co.kr/news/pc/view/view.do?ncd=7890091&ref=A,https://n.news.naver.com/mnews/article/056/0011661908?sid=104
268,2024-02-14 20:22:00,"[뉴스하이킥] 의사 출신 野 신현영 &quot;정부, 총선 앞두고 인기영합주의 의대 증...",이런 것들에 대한 근거 체계를 만들자고 그리고 그걸 논의할 수 있는 <b>전문가</b> 기구를 만들자고 법안도 냈고요.... 하지만 또 <b>인공지능</b>이 발달하고 디지털 헬스케어가 되면 의사들이 많이 대체된다고 해요. 그래서 우리가... ,,https://n.news.naver.com/mnews/article/214/0001330617?sid=100
269,2024-02-14 20:18:00,경기도 163만 1인가구 영역별 '맞춤 돌봄' 서비스,"도는 1인 가구를 위해 <b>인공지능</b> 노인말벗서비스, 주거안전 체크리스트 개발 등에 따른 39개 과제를 정하고... 주거.안전 <b>전문가</b>, 경기도 여성가족재단과 협업해 경기도 특성과 주택유형 등을 반영한 경기도형 '안전한... ",https://www.incheonilbo.com/news/articleView.html?idxno=1234326,https://www.incheonilbo.com/news/articleView.html?idxno=1234326
270,2024-02-14 19:54:00,"전남도, ‘AI 축산업 융복합밸리’ 조성 잰걸음","6일 <b>전문가</b>들과 함께 첨단 축산업 융복합 밸리 조성 협의회를 개최해 용역 방향과 스마트 축산단지, 말산업 육성 추진 등 세부 실현 방안에 대한 다양한 의견을 나눴다. 미래 축산업 100년을 이끌 ‘<b>인공지능</b> 첨단 축산업... ",http://www.kjdaily.com/article.php?aid=1707907389622315074,http://www.kjdaily.com/article.php?aid=1707907389622315074
271,2024-02-14 19:40:00,"[보험 현미경] DB손보, 빅데이터 기반 'AI 비서' 특허 획득","해당 시스템은 <b>인공지능</b>(AI)을 통해 영업현장에서 고객별 보장분석과 맞춤설계, 사전심사를 동시에 수행할 수... 멘토링과 <b>전문가</b> 상담 등 청소년들에게 정서적 위로를 전하는 다양한 콘텐츠를 선보이고 있다. 김민석... ",https://www.asiatime.co.kr/article/20240214500374,https://www.asiatime.co.kr/article/20240214500374
272,2024-02-14 19:32:00,"예산군 평생학습관, 프로그램 수강생 모집, 58개 강좌 860명",올해 상반기 교육은 △장애인평생교육강사 2급과정 △금융<b>전문가</b>가 알려주는 주식투자 분석법 △타로교실... 프로그램 △<b>인공지능</b> 대화생성기(chat GPT) △첫 출근 날부터 바로 쓰는 사무실(오피스) 문서 등... ,http://www.dynews.co.kr/news/articleView.html?idxno=740036,http://www.dynews.co.kr/news/articleView.html?idxno=740036
273,2024-02-14 19:32:00,"진천군, 디지털 미래인재 양성 박차",심화 교육과정은 충북혁신도시 복합혁신센터 내에 조성된 K-스마트 <b>인공지능</b> 교육센터에서 오는 4월부터 국내 최고 과학 전문기관인 한국과학기술원(카이스트)의 융합 교육연구센터 <b>전문가</b>와 함께 △주제별... ,http://www.dynews.co.kr/news/articleView.html?idxno=740059,http://www.dynews.co.kr/news/articleView.html?idxno=740059
274,2024-02-14 19:25:00,"[경기24시] 경기도, 북부청사에 태양광발전소 준공…주민참여형 공공기관 RE1...","주거·안전 <b>전문가</b>, 경기도 여성가족재단과 협업해 경기도 특성과 주택유형 등을 반영할 방침이다. '<b>인공지능</b>(AI) 노인말벗서비스'는 안부확인이 필요한 65세 이상 노인을 대상으로 주 1회 <b>인공지능</b> 상담원이 안부전화... ",http://www.sisajournal.com/news/articleView.html?idxno=283318,https://n.news.naver.com/mnews/article/586/0000072822?sid=102
275,2024-02-14 19:20:00,생거진천형 K-스마트교육 갑진년 더 큰 도약 준비,마련한 'K-스마트 <b>인공지능</b> 교육센터'에서 4월부터 실시한다. 새로 조성한 쾌적한 환경에서 국내 최고 과학 전문기관인 한국과학기술원(카이스트)의 융합 교육연구센터 <b>전문가</b>와 함께 △주제별 소프트웨어(SW) 교육... ,https://www.ccdn.co.kr/news/articleView.html?idxno=960181,https://www.ccdn.co.kr/news/articleView.html?idxno=960181
276,2024-02-14 19:10:00,"세브란스병원, 간암 방사선색전술 500례 달성 外","세브란스병원 간암센터는 소화기내과, 외과, 영상의학과, 방사선종양학과 등 <b>전문가</b>들이 모여 다학제... 의료 <b>인공지능</b> 알고리즘'을 개발했다. 이후 수면 단계 자동 판독 가능성을 분석했다. 분석 결과, 새로 개발된... ",http://www.newsmp.com/news/articleView.html?idxno=239332,http://www.newsmp.com/news/articleView.html?idxno=239332
277,2024-02-14 19:02:00,[조맹기의 언론 톺아보기] 이번 총선에서 86운동권 정치인들의 허상 벗겨내자,이러한 미국의 노동생산성 향상은 <b>인공지능</b>(AI) 산업의 출현으로 더 가속화 할 수 있다. 다만 <b>전문가</b>들은 최근 미국의 노동생산성 향상에는 유연한 노동시장이 더 근본적 원인이라고 지적한다. 고용시장이 경직적인... ,https://www.skyedaily.com/news/news_view.html?ID=221479,https://www.skyedaily.com/news/news_view.html?ID=221479
278,2024-02-14 19:00:00,"라이다 솔루션 뷰런, AI 딥러닝 <b>전문가</b> 제홍모 CTO 영입","이번에 영입한 제 총괄은 올라웍스, 인텔코리아, 스트타비젼 등 20년 이상 국내외에서 현장 경험을 쌓아온 <b>인공지능</b>(AI) 분야 <b>전문가</b> 중 한 명이다. 특히, CTO로 역임했던 스트라드비젼에서는 ADAS를 위한 딥러닝... ",http://news.mt.co.kr/mtview.php?no=2024021409593699643,https://n.news.naver.com/mnews/article/008/0004998744?sid=101
279,2024-02-14 18:40:00,"삼성전자, 기술 인력에 '올인'...경력 사원 대거 채용","삼성전자가 <b>인공지능</b>(AI)과 반도체, 가전, 전장(자동차 전기·전자 장비) 등 사실상 전 분야에서 경력사원을... 맡을 <b>전문가</b>를 모집한다. 2년 이상의 AI, 머신러닝, 데이터 분석 업무 경험자와 중앙처리장치(CPU) 관련... ",http://www.fieldnews.kr/news/articleView.html?idxno=2499,http://www.fieldnews.kr/news/articleView.html?idxno=2499
280,2024-02-14 18:39:00,17년 공운법 '그늘' 벗어난 출연연…우수인재 특채 가능할까,따라서 큰 틀에서는 <b>인공지능</b>(AI) 분야에서 <b>전문가</b>들을 모셔오는 것처럼 우수 인재를 확보할 수 있게 되리라고 본다”고 설명했다. 출연연도 이에 대한 기대가 크다. 한 출연연 부원장은 “그동안 인력 채용과 관련해 많은... ,http://www.edaily.co.kr/news/newspath.asp?newsid=04044246638790520,https://n.news.naver.com/mnews/article/018/0005673449?sid=105
281,2024-02-14 18:32:00,신사업 탄력 받은 한화 3남 '김동선'…'푸드테크' 시너지 낼까,"TF 신임 팀장은 식음 부문 <b>전문가</b>로 꼽았다. 기존의 다양한 외식산업 추진 경험을 바탕으로 기술진과 협업해... 아니라 <b>인공지능</b>(AI), 빅데이터를 접목한 다양한 기술 개발에 나설 전망이다. 한화푸드테크 관계자는... ",http://www.g-enews.com/ko-kr/news/article/news_all/2024021416185974591c3c506100_1/article.html,http://www.g-enews.com/ko-kr/news/article/news_all/2024021416185974591c3c506100_1/article.html
282,2024-02-14 18:20:00,"경기도, 1인가구 '아늑하고 안전한 연결망' 지원 받는다","14일 경기도에 따르면 도는 '2024년 경기도 1인가구 지원 시행계획'을 수립해 <b>인공지능</b>(AI) 노인말벗서비스... 도는 주거·안전 <b>전문가</b>, 경기여성가족재단과 협업해 도 특성과 주택유형 등을 반영한 경기도형 '안전한 집... ",http://www.joongboo.com/news/articleView.html?idxno=363635976,http://www.joongboo.com/news/articleView.html?idxno=363635976
283,2024-02-14 18:20:00,"원프레딕트, 국내 최초 GS칼텍스 설비관리에 AI 예측진단 솔루션 '가디원 터보...","GS칼텍스 여수공장 대형 회전기계에 AI예측진단 솔루션 '가디원 터보' 구축 산업 <b>인공지능</b>(AI) 기반 설비... 관리 <b>전문가</b>의 지식과 경험에 의존했던 기존, 회전 설비 관리 방식에 혁신의 틀을 마련하게 된 것이다.... ",https://www.aitimes.kr/news/articleView.html?idxno=30328,https://www.aitimes.kr/news/articleView.html?idxno=30328
284,2024-02-14 18:19:00,"[목요일 아침에] 일자리 도시, 잠자리 도시","아부다비는 2006년부터 ‘마스다르시티’ 건설을 추진해 <b>인공지능</b>(AI)을 비롯한 첨단기술 기업 1000개 이상을... 혁신적 도시 개발은 어느 한 분야의 <b>전문가</b>만으로는 이룰 수 없다. 도시계획, 건축 토목, 교통·물류 등... ",https://www.sedaily.com/NewsView/2D5CX0UGVP,https://n.news.naver.com/mnews/article/011/0004299650?sid=110
285,2024-02-14 18:18:00,"핑거, 중소기업 비즈니스웨어 파로스 출시","<b>전문가</b>가 아니더라도 누구나 쉽게 사용이 가능한 통합 서비스로 재무, 회계·결산, 인사·급여, 금융... 핑거는 지난 23년간 금융권 핀테크 사업을 통해 쌓아온 <b>인공지능</b>(AI), 빅데이터, 클라우드 기반 기술이 집약된... ",http://www.edaily.co.kr/news/newspath.asp?newsid=03968806638790520,https://n.news.naver.com/mnews/article/018/0005673425?sid=101
286,2024-02-14 18:18:00,"진천군, 지역특화 생거진천형 K-스마트교육 확대 운영",<b>인공지능</b> 교육센터’에서 4월부터 실시한다. 새로 조성한 쾌적한 환경에서 국내 최고 과학 전문기관인 한국과학기술원(카이스트)의 융합 교육연구센터 <b>전문가</b>와... ,http://www.breaknews.com/1015774,http://www.breaknews.com/1015774
287,2024-02-14 18:10:00,"삼성전자, AIㆍ반도체 全 영역서 경력사원 대거 뽑는다","삼성전자가 <b>인공지능</b>(AI)과 반도체, 가전, 전장(자동차 전기·전자 장비) 등 전 분야에서 경력사원을 대거... 맡을 <b>전문가</b>를 충원한다. 모바일경험(MX) 사업부는 보안 전략 수립과 관련 솔루션 개발 직무를 수행할... ",https://www.financialpost.co.kr/news/articleView.html?idxno=200816,https://www.financialpost.co.kr/news/articleView.html?idxno=200816
288,2024-02-14 18:08:00,'가짜 한동훈' 잡고 로고송 만들고…선거판 살림꾼 된 AI [긱스],파일을 <b>인공지능</b>(AI) 스타트업 딥브레인AI의 딥페이크 탐지 솔루션에 올리자 AI가 빠르게 조작 여부를... <b>전문가</b>들은 다음 선거부터는 AI를 제대로 감시하면서도 적절히 활용할 수 있는 방안을 새롭게 모색해야 한다고... ,https://www.hankyung.com/article/2024021438081,https://n.news.naver.com/mnews/article/015/0004948342?sid=101
289,2024-02-14 18:06:00,조선업이 AI를 만나 똑똑해진다…'스마트 조선소' 경쟁,"대표적 노동 집약형 산업인 조선업계가 <b>인공지능</b>(AI) 기술 적용에 속도를 내고 있다. 견적부터 인도까지... 올해 1월부터 산업 특화 AI 솔루션 및 서비스를 개발하고, AI 기반 플랫폼 개발 및 AI <b>전문가</b> 양성을 우선... ",https://www.bizhankook.com/article/27102,https://www.bizhankook.com/article/27102
290,2024-02-14 18:05:00,"셀바스헬스케어, 'AI 의료' 셀바스인비전 합작법인 설립",셀바스헬스케어(208370)는 미국 울트라사이트(UltraSight)가 <b>인공지능</b>(AI) 의료 사업을 위한 합작법인(JV)... 다비디 보트만(Davidi Vortman) 울트라사이트 최고경영자(CEO)는 “울트라사이트는 의료 <b>전문가</b>들이 병원 안팎에서... ,http://www.edaily.co.kr/news/newspath.asp?newsid=03913046638790520,https://n.news.naver.com/mnews/article/018/0005673411?sid=101
291,2024-02-14 18:04:00,김영진 &quot;초고령사회 대응 지역별 돌봄센터 추진&quot;,"구축하겠다&quot;며 &quot;특히 <b>인공지능</b> 등을 기반으로 한 센서와 로봇 기반 돌봄 서비스 확대로 거동이 불편한 노인의 일상생활을 보조하고, 안전관리 요원 및 생활관리사 등의 돌봄 <b>전문가</b>와 가족의 부담을 줄이도록 하겠다&quot;고... ",http://www.jejuilbo.net/news/articleView.html?idxno=222681,http://www.jejuilbo.net/news/articleView.html?idxno=222681
292,2024-02-14 17:56:00,"삼성전자, 직군별 경력사원 대거 채용… 미래 기술인재 영입","삼성전자가 <b>인공지능</b>(AI)과 반도체, 가전, 전장(자동차 전기·전자 장비) 등 거의 모든 직군에서 대규모... 맡을 <b>전문가</b>를 모집한다. 2년 이상의 AI, 머신러닝, 데이터 분석 업무 경험자와 중앙처리장치(CPU) 관련 시스템... ",https://sateconomy.co.kr/news/view/1065601988598995,https://sateconomy.co.kr/news/view/1065601988598995
